Unnamed: 0,symbol,shortName,startDate,description_yf,regularMarketVolume,averageVolume,volume24Hr,volumeAllCurrencies,circulatingSupplymarketCap,currency,quoteSourceName,lastMarket,tradeable,language,region,typeDisp,triggerable,customPriceAlertConfidence,cryptoTradeable,trailingPegRatio,level1_x,level2_x,level3_x,ticker,level1_y,level2_y,level3_y,tokenTaxonomy,description_gemini,name,price,change,change_percent,market_cap,volume,level1,level2,level3,ticker_clean,json_ticker,cmc_categories,cmc_categories_str,has_price
3489,SHR-USD,ShareToken USD,1574726400.0,"ShareToken (SHR) is a cryptocurrency launched in 2018and operates on the BNB Beacon Chain (BEP2) platform. ShareToken has a current supply of 6,434,460,139.8 with 2,370,272,782.106575 in circulation. The last known price of ShareToken is 0.00178772 USD and is down -1.59 over the last 24 hours. It is currently trading on 18 active market(s) with $130,816.46 traded over the last 24 hours. More information can be found at https://sharering.network/.",103572.0,192077.0,103572.0,103572.0,,USD,CoinMarketCap,CoinMarketCap,False,en-US,US,Cryptocurrency,True,HIGH,False,,dApps,Travel & Leisure,Loyalty Programs,ShareToken,dApps,Travel & Leisure,Loyalty Programs,Cryptocurrency,ShareToken aimed to revolutionize the travel and hospitality industry by providing a loyalty program and payment solution. It sought to enable users to earn and spend SHARE tokens on various travel-related services.,ShareToken,0.001523 -0.000001 (-0.09%),-1e-06,-0.09%,3609000.0,287113.0,dApps,Travel & Leisure,Loyalty Programs,SHR,,,Unknown,True
3490,SHX-USD,Stronghold SHx USD,1546473600.0,"Stronghold SHx (SHX) is a cryptocurrency and operates on the Ethereum platform. Stronghold SHx has a current supply of 99,756,866,344 with 5,793,905,044 in circulation. The last known price of Stronghold SHx is 0.0102189 USD and is down -1.23 over the last 24 hours. It is currently trading on 37 active market(s) with $437,736.00 traded over the last 24 hours. More information can be found at https://stronghold.co/shx.",267729.0,1026548.0,267729.0,267729.0,,USD,CoinMarketCap,CoinMarketCap,False,en-US,US,Cryptocurrency,True,HIGH,False,,cApps,Centralized Finance (CeFi),Payment Solutions,SHx,cApps,Centralized Finance (CeFi),Payment Solutions,Utility Token,"Stronghold SHx is a token used within the Stronghold ecosystem to facilitate payments and provide access to various financial services. It aims to provide a faster, cheaper, and more secure way to transfer value within a regulated environment.",Stronghold SHx,0.021353 -0.000552 (-2.52%),-0.000552,-2.52%,123717000.0,1654000.0,cApps,Centralized Finance (CeFi),Payment Solutions,SHX,,,Unknown,True
3503,SIX-USD,SIX USD,1537488000.0,"SIX (SIX) is a cryptocurrency and operates on the Ethereum platform. SIX has a current supply of 999,999,970 with 850,966,610.126 in circulation. The last known price of SIX is 0.01982436 USD and is down -0.03 over the last 24 hours. It is currently trading on 23 active market(s) with $500,293.89 traded over the last 24 hours. More information can be found at https://six.network/.",466664.0,908444.0,466664.0,466664.0,,USD,CoinMarketCap,CoinMarketCap,False,en-US,US,Cryptocurrency,True,HIGH,False,,dApps,Entertainment/Leisure,Digital Media,SIX,dApps,Entertainment/Leisure,Digital Media,Cryptocurrency,SIX Network aims to build a decentralized financial infrastructure for the creative economy. It focuses on empowering creators and facilitating transactions related to digital assets and intellectual property.,SIX,0.021372 -0.000171 (-0.79%),-0.000171,-0.79%,18187000.0,396434.0,dApps,Entertainment/Leisure,Digital Media,SIX,,,Unknown,True
3507,SKEY-USD,Skey Network USD,1609200000.0,"Skey Network (SKEY) is a cryptocurrency launched in 2020and operates on the Ethereum platform. Skey Network has a current supply of 1,000,000,000 with 411,353,542.90979763 in circulation. The last known price of Skey Network is 0.0223934 USD and is down -4.14 over the last 24 hours. It is currently trading on 10 active market(s) with $309,515.04 traded over the last 24 hours. More information can be found at https://skey.network/.",315868.0,418060.0,315868.0,315868.0,,USD,CoinMarketCap,CoinMarketCap,False,en-US,US,Cryptocurrency,True,HIGH,False,,Smart Contract Platform,Infrastructure,Identity & Access Management,SKEY,Smart Contract Platform,Infrastructure,Identity & Access Management,Native Currency,Skey Network aims to build a decentralized ecosystem for connecting devices and services using blockchain-based identity and access management. It focuses on creating secure and verifiable access control for IoT and other applications.,Skey Network,0.010302 -0.000903 (-8.06%),-0.000903,-8.06%,4561000.0,49288.0,Smart Contract Platform,Infrastructure,Identity & Access Management,SKEY,,,Unknown,True
3511,SKI-USD,Skillchain USD,1590451200.0,"Skillchain (SKI) is a cryptocurrency launched in 2018and operates on the Ethereum platform. Skillchain has a current supply of 190,800,000 with 0 in circulation. The last known price of Skillchain is 0.00155988 USD and is up 0.02 over the last 24 hours. It is currently trading on 8 active market(s) with $2.05 traded over the last 24 hours. More information can be found at https://www.skillchain.io/.",2.0,35.0,2.0,2.0,,USD,CoinMarketCap,CoinMarketCap,False,en-US,US,Cryptocurrency,True,HIGH,False,,dApps,Entertainment/Leisure,Gaming,SKI,dApps,Entertainment/Leisure,Gaming,Cryptocurrency,"Skillchain is a blockchain-based platform designed to connect esports players, teams, and organizations. The SKI token is used within the Skillchain ecosystem for transactions, rewards, and governance.",Skillchain,,,,,,dApps,Entertainment/Leisure,Gaming,SKI,,,Unknown,True
3512,SKLAY-USD,sKLAY USD,1607299200.0,sKLAY (SKLAY) is a cryptocurrency launched in 2020. sKLAY has a current supply of 0. The last known price of sKLAY is 0.15267545 USD and is down -4.24 over the last 24 hours. It is currently trading on 2 active market(s) with $430.88 traded over the last 24 hours. More information can be found at https://klaystation.io/.,309.0,3767.0,309.0,309.0,,USD,CoinMarketCap,CoinMarketCap,False,en-US,US,Cryptocurrency,True,HIGH,False,,dApps,Decentralized Finance (DeFi),Staking,sKLAY,dApps,Decentralized Finance (DeFi),Staking,Derivative Token,"sKLAY is a token representing Klaytn (KLAY) that has been staked within a staking contract, typically used to earn rewards. It essentially represents a claim on the underlying KLAY plus accumulated staking rewards.",sKLAY,,,,,,dApps,Decentralized Finance (DeFi),Staking,SKLAY,,,Unknown,True
3513,SKL-USD,SKALE USD,1591920000.0,"SKALE (SKL) is a cryptocurrency launched in 2020and operates on the Ethereum platform. SKALE has a current supply of 6,095,250,000 with 5,795,102,671 in circulation. The last known price of SKALE is 0.02777871 USD and is down -3.31 over the last 24 hours. It is currently trading on 198 active market(s) with $26,559,778.13 traded over the last 24 hours. More information can be found at https://skale.space/?utm_medium=website&utm_source=coinmarketcap&utm_campaign=skalepage.",22217652.0,47103987.0,22217652.0,22217652.0,,USD,CoinMarketCap,CoinMarketCap,False,en-US,US,Cryptocurrency,True,HIGH,False,,Smart Contract Platform,Infrastructure,Infrastructure,SKALE,Smart Contract Platform,Infrastructure,Infrastructure,Native Currency,"SKALE Network is a modular layer-1/layer-2 hybrid network designed to bring Web3 to billions of users. It provides a high-performance, low-cost, and secure infrastructure for decentralized applications.",SKALE,0.022831 +0.000429 (+1.92%),0.000429,+1.92%,135208000.0,9680000.0,Smart Contract Platform,Infrastructure,Infrastructure,SKL,SKL,"['Storage', 'BoostVC Portfolio', 'Play To Earn', 'Scaling', 'Galaxy Digital Portfolio']",Storage; BoostVC Portfolio; Play To Earn; Scaling; Galaxy Digital Portfolio,True
3531,SLP-USD,Smooth Love Potion USD,1594166400.0,"Smooth Love Potion (SLP) is a cryptocurrency and operates on the Ethereum platform. Smooth Love Potion has a current supply of 41,164,503,246. The last known price of Smooth Love Potion is 0.00190456 USD and is down -2.75 over the last 24 hours. It is currently trading on 237 active market(s) with $9,916,585.36 traded over the last 24 hours. More information can be found at https://axieinfinity.com/.",7171137.0,17621278.0,7171137.0,7171137.0,,USD,CoinMarketCap,CoinMarketCap,False,en-US,US,Cryptocurrency,True,HIGH,False,,dApps,Entertainment/Leisure,Gaming,SLP,dApps,Entertainment/Leisure,Gaming,Cryptocurrency,"Smooth Love Potion (SLP) tokens are earned by playing the Axie Infinity game. SLP is used to breed new Axies, and is thus an essential utility token within the Axie Infinity ecosystem.",Smooth Love Potion,0.002113 +0.000041 (+1.96%),4.1e-05,+1.96%,76008000.0,56859000.0,dApps,Entertainment/Leisure,Gaming,SLP,,,Unknown,True
3537,SMARTCREDIT-USD,SmartCredit Token USD,1604534400.0,"SmartCredit Token (SMARTCREDIT) is a cryptocurrency launched in 2018and operates on the Ethereum platform. SmartCredit Token has a current supply of 25,000,000 with 0 in circulation. The last known price of SmartCredit Token is 0.28427621 USD and is up 2.98 over the last 24 hours. It is currently trading on 6 active market(s) with $15.46 traded over the last 24 hours. More information can be found at https://smartcredit.io/.",15.0,22.0,15.0,15.0,,USD,CoinMarketCap,CoinMarketCap,False,en-US,US,Cryptocurrency,True,HIGH,False,,dApps,Decentralized Finance (DeFi),Credit/Lending,SmartCredit Token,dApps,Decentralized Finance (DeFi),Credit/Lending,Cryptocurrency,SmartCredit is a DeFi lending protocol that allows users to create and participate in decentralized lending markets. The SmartCredit Token is used within the platform for governance and potentially other utilities like staking or reward distribution.,SmartCredit Token,,,,,,dApps,Decentralized Finance (DeFi),Credit/Lending,SMARTCREDIT,,,Unknown,True
3538,SMART-USD,SmartCash USD,1500595200.0,"SmartCash (SMART) is a cryptocurrency . Users are able to generate SMART through the process of mining. SmartCash has a current supply of 2,014,903,576.72334 with 1,413,859,297.52334 in circulation. The last known price of SmartCash is 0.00002063 USD and is down -31.27 over the last 24 hours. It is currently trading on 15 active market(s) with $0.60 traded over the last 24 hours. More information can be found at https://smartcash.cc/.",0.0,145.0,0.0,0.0,,USD,CoinMarketCap,CoinMarketCap,False,en-US,US,Cryptocurrency,True,HIGH,False,,Cryptocurrencies,Infrastructure,Payments,SmartCash,Cryptocurrencies,Infrastructure,Payments,Cryptocurrency,"SmartCash is a community-governed cryptocurrency focused on creating a sustainable, scalable, and adaptable economic model. It aims to foster growth and development through decentralized governance and incentivized participation.",SmartCash,0.000023 -0.000004 (-15.31%),-4e-06,-15.31%,33089.0,8.0,Cryptocurrencies,Infrastructure,Payments,SMART,,,Unknown,True
3551,SNB-USD,SynchroBitcoin USD,1583452800.0,"SynchroBitcoin (SNB) is a cryptocurrency launched in 2019and operates on the Ethereum platform. SynchroBitcoin has a current supply of 1,000,000,000 with 80,295,231.34038519 in circulation. The last known price of SynchroBitcoin is 0.00041881 USD and is down -3.22 over the last 24 hours. It is currently trading on 4 active market(s) with $141.43 traded over the last 24 hours. More information can be found at https://www.snbtoken.io.",141.0,160.0,141.0,141.0,,USD,CoinMarketCap,CoinMarketCap,False,en-US,US,Cryptocurrency,True,HIGH,False,,Cryptocurrencies,Infrastructure,Payments,SNB,Cryptocurrencies,Infrastructure,Payments,Cryptocurrency,"SynchroBitcoin (SNB) aimed to be a decentralized cryptocurrency focused on secure and fast transactions. While it is considered largely defunct now, it functioned like other payment-oriented cryptocurrencies.",SynchroBitcoin,0.000116 -0.000000 (-0.00%),-0.0,-0.00%,9318.0,3.0,Cryptocurrencies,Infrastructure,Payments,SNB,,,Unknown,True
3552,SNC-USD,SunContract USD,1499299200.0,"SunContract (SNC) is a cryptocurrency launched in 2017and operates on the Ethereum platform. SunContract has a current supply of 122,707,502.69296219 with 74,884,946.94525845 in circulation. The last known price of SunContract is 0.02649061 USD and is down -3.27 over the last 24 hours. It is currently trading on 13 active market(s) with $152,765.72 traded over the last 24 hours. More information can be found at https://suncontract.org/.",155088.0,199050.0,155088.0,155088.0,,USD,CoinMarketCap,CoinMarketCap,False,en-US,US,Cryptocurrency,True,HIGH,False,,dApps,Energy,Renewable Energy Marketplace,SNC,dApps,Energy,Renewable Energy Marketplace,Utility Token,"SunContract is a blockchain-based peer-to-peer energy marketplace. It facilitates the direct trading of electricity between consumers and producers, particularly those involved in renewable energy.",SunContract,0.037039 +0.000799 (+2.21%),0.000799,+2.21%,2903000.0,904709.0,dApps,Energy,Renewable Energy Marketplace,SNC,SNC,['Energy'],Energy,True
3563,SNRG-USD,Synergy USD,1433721600.0,"Synergy (SNRG) is a cryptocurrency . Synergy has a current supply of 4,897,671.655004 with 0 in circulation. The last known price of Synergy is 0.04323987 USD and is up 0.00 over the last 24 hours. It is currently trading on 1 active market(s) with $0.00 traded over the last 24 hours. More information can be found at http://www.synergycoin.com/.",6.0,0.0,6.0,6.0,,USD,CoinMarketCap,CoinMarketCap,False,en-US,US,Cryptocurrency,True,HIGH,False,,dApps,Decentralized Finance (DeFi),Yield Aggregation,Synergy,dApps,Decentralized Finance (DeFi),Yield Aggregation,Cryptocurrency,Synergy is a decentralized yield aggregation platform that aims to optimize returns for users by automating DeFi strategies. It allows users to deposit their assets and earn rewards through various yield farming opportunities.,Synergy,,,,,,dApps,Decentralized Finance (DeFi),Yield Aggregation,SNRG,,,Unknown,True
3565,SNT-USD,Status USD,1498608000.0,"Status (SNT) is a cryptocurrency and operates on the Ethereum platform. Status has a current supply of 6,804,870,174.87816825 with 3,997,940,873.51815452 in circulation. The last known price of Status is 0.02634839 USD and is down -3.01 over the last 24 hours. It is currently trading on 165 active market(s) with $7,970,175.37 traded over the last 24 hours. More information can be found at http://status.im/.",5801029.0,24216107.0,5801029.0,5801029.0,,USD,CoinMarketCap,CoinMarketCap,False,en-US,US,Cryptocurrency,True,HIGH,False,,dApps,Social Networking/Communication,Decentralized Social Media,SNT,dApps,Social Networking/Communication,Decentralized Social Media,Utility Token,"Status is an open source messaging platform and mobile interface that interacts with Ethereum-based decentralized applications. SNT is a utility token used within the Status network to access features like governance, staking, and curated content.",Status,0.030418 +0.000032 (+0.10%),3.2e-05,+0.10%,144159000.0,8340999.999999999,dApps,Social Networking/Communication,Decentralized Social Media,SNT,SNT,"['Media', 'Content Creation']",Media; Content Creation,True
3567,SNX-USD,Synthetix USD,1520985600.0,"Synthetix (SNX) is a cryptocurrency and operates on the Ethereum platform. Synthetix has a current supply of 339,889,850.0887736 with 339,466,216.99039868 in circulation. The last known price of Synthetix is 0.87287964 USD and is down -3.08 over the last 24 hours. It is currently trading on 654 active market(s) with $24,076,619.25 traded over the last 24 hours. More information can be found at https://www.synthetix.io/.",15478789.0,44041535.0,15478789.0,15478789.0,,USD,CoinMarketCap,CoinMarketCap,False,en-US,US,Cryptocurrency,True,HIGH,False,,dApps,Decentralized Finance (DeFi),Derivatives/Synthetics,SNX,dApps,Decentralized Finance (DeFi),Derivatives/Synthetics,Utility Token,"Synthetix is a decentralized synthetic asset issuance protocol built on Ethereum. It enables the creation and trading of synthetic assets (Synths) that track the value of real-world assets, such as stocks, commodities, and currencies.",Synthetix,0.662276 +0.009216 (+1.41%),0.009216,+1.41%,227469000.0,10940000.0,dApps,Decentralized Finance (DeFi),Derivatives/Synthetics,SNX,SNX,"['Fantom Ecosystem', 'Three Arrows Capital Portfolio', 'Yield Farming', 'Derivatives', 'Near Protocol Ecosystem', 'Decentralized Exchange (DEX) Token', 'HECO Ecosystem', 'Celsius Bankruptcy Estate', 'Avalanche Ecosystem', 'Governance', 'ParaFi Capital', 'Paradigm Portfolio', 'DeFiance Capital Portfolio', 'Spartan Group', 'Optimism Ecosystem', 'Framework Ventures Portfolio', 'Synthetics']",Fantom Ecosystem; Three Arrows Capital Portfolio; Yield Farming; Derivatives; Near Protocol Ecosystem; Decentralized Exchange (DEX) Token; HECO Ecosystem; Celsius Bankruptcy Estate; Avalanche Ecosystem; Governance; ParaFi Capital; Paradigm Portfolio; DeFiance Capital Portfolio; Spartan Group; Optimism Ecosystem; Framework Ventures Portfolio; Synthetics,True
3593,SOLO-USD,Sologenic USD,1583452800.0,"Sologenic (SOLO) is a cryptocurrency launched in 2020and operates on the BNB Smart Chain (BEP20) platform. Sologenic has a current supply of 399,947,699. The last known price of Sologenic is 0.28820273 USD and is down -7.53 over the last 24 hours. It is currently trading on 65 active market(s) with $1,834,192.93 traded over the last 24 hours. More information can be found at https://www.sologenic.org/.",1829445.0,2969229.0,1829445.0,1829445.0,,USD,CoinMarketCap,CoinMarketCap,False,en-US,US,Cryptocurrency,True,HIGH,False,,dApps,Decentralized Finance (DeFi),Tokenization,SOLO,dApps,Decentralized Finance (DeFi),Tokenization,Cryptocurrency,"Sologenic is a decentralized ecosystem built on the XRP Ledger that facilitates the tokenization of securities and other assets. It aims to bridge the gap between traditional financial markets and the cryptocurrency space, enabling users to trade tokenized assets like stocks and ETFs on a decentralized exchange.",Sologenic,0.445192 -0.002699 (-0.60%),-0.002699,-0.60%,177532000.0,1648000.0,dApps,Decentralized Finance (DeFi),Tokenization,SOLO,,,Unknown,True
3595,SOL-USD,Solana USD,1586476800.0,"Solana (SOL) is a cryptocurrency launched in 2020. Solana has a current supply of 595,738,476.2036142 with 508,900,023.78269213 in circulation. The last known price of Solana is 138.03407618 USD and is down -4.69 over the last 24 hours. It is currently trading on 848 active market(s) with $5,078,628,606.80 traded over the last 24 hours. More information can be found at https://solana.com.",2274729728.0,5721138193.0,2274729728.0,2274729728.0,,USD,CoinMarketCap,CoinMarketCap,False,en-US,US,Cryptocurrency,True,HIGH,True,,Smart Contract Platform,Infrastructure,Infrastructure,Solana,Smart Contract Platform,Infrastructure,Infrastructure,Native Currency,"Solana is a high-performance, permissionless blockchain providing fast transaction speeds and low costs. It supports smart contracts and decentralized applications, aiming to provide scalable solutions for the blockchain ecosystem.",Solana,186.60 -0.90 (-0.48%),-0.9,-0.48%,100471000000.0,3567000000.0,Smart Contract Platform,Infrastructure,Infrastructure,SOL,SOL,"['US Strategic Crypto Reserve', 'Multicoin Capital Portfolio', 'Made in America', 'CMS Holdings Portfolio', 'Solana Ecosystem', 'Binance Ecosystem', 'Alleged SEC Securities', 'Alameda Research Portfolio', 'CMC Crypto Awards 2024', 'Layer 1', 'FTX Bankruptcy Estate', 'OKX Ventures Portfolio', 'Kenetic Capital Portfolio']",US Strategic Crypto Reserve; Multicoin Capital Portfolio; Made in America; CMS Holdings Portfolio; Solana Ecosystem; Binance Ecosystem; Alleged SEC Securities; Alameda Research Portfolio; CMC Crypto Awards 2024; Layer 1; FTX Bankruptcy Estate; OKX Ventures Portfolio; Kenetic Capital Portfolio,True
3598,SOLVE-USD,SOLVE USD,1549238400.0,"SOLVE (SOLVE) is a cryptocurrency launched in 2017and operates on the Ethereum platform. SOLVE has a current supply of 1,000,000,000 with 700,125,013 in circulation. The last known price of SOLVE is 0.00164483 USD and is up 2.02 over the last 24 hours. It is currently trading on 23 active market(s) with $636,687.15 traded over the last 24 hours. More information can be found at https://tuumio.com/.",456253.0,250817.0,456253.0,456253.0,,USD,CoinMarketCap,CoinMarketCap,False,en-US,US,Cryptocurrency,True,HIGH,False,,dApps,Healthcare,Healthcare Solutions,SOLVE,dApps,Healthcare,Healthcare Solutions,Utility Token,"SOLVE token is the utility token for the Solve.Care platform, a healthcare platform that utilizes blockchain technology to improve care coordination, access, and payments. It facilitates transactions and interactions within the Solve.Care ecosystem.",SOLVE,0.000152 -0.000067 (-30.74%),-6.7e-05,-30.74%,106290.0,2746.0,dApps,Healthcare,Healthcare Solutions,SOLVE,SOLVE,['Health'],Health,True
3610,SOP-USD,SoPay USD,1531872000.0,"SoPay (SOP) is a cryptocurrency and operates on the Ethereum platform. SoPay has a current supply of 4,500,000,000 with 0 in circulation. The last known price of SoPay is 0.00001021 USD and is up 4.36 over the last 24 hours. It is currently trading on 3 active market(s) with $6.38 traded over the last 24 hours. More information can be found at https://sopay.org/en.",11.0,213.0,11.0,11.0,,USD,CoinMarketCap,CoinMarketCap,False,en-US,US,Cryptocurrency,True,HIGH,False,,Cryptocurrencies,Infrastructure,Payments,SoPay,Cryptocurrencies,Infrastructure,Payments,Cryptocurrency,"SoPay aimed to be a cryptocurrency focused on facilitating payments, particularly in emerging markets. Its goal was to provide a fast and low-cost payment solution.",SoPay,,,,,,Cryptocurrencies,Infrastructure,Payments,SOP,,,Unknown,True
3614,SOUL-USD,Phantasma USD,1527465600.0,"Phantasma (SOUL) is a cryptocurrency launched in 2018and operates on the Ethereum platform. Phantasma has a current supply of 124,129,197.66163056. The last known price of Phantasma is 0.07919511 USD and is up 3.55 over the last 24 hours. It is currently trading on 23 active market(s) with $158,377.30 traded over the last 24 hours. More information can be found at https://phantasma.info/.",154157.0,295274.0,154157.0,154157.0,,USD,CoinMarketCap,CoinMarketCap,False,en-US,US,Cryptocurrency,True,HIGH,False,,Smart Contract Platform,Infrastructure,Infrastructure,SOUL,Smart Contract Platform,Infrastructure,Infrastructure,Native Currency,"Phantasma is a blockchain platform designed for NFTs, gaming, and decentralized applications. It features dual token economics with SOUL and KCAL, aiming to provide fast and cost-effective transactions.",Phantasma,0.041345 +0.001061 (+2.63%),0.001061,+2.63%,5132000.0,220476.0,Smart Contract Platform,Infrastructure,Infrastructure,SOUL,,,Unknown,True
3623,SPARTA-USD,Spartan Protocol USD,1599696000.0,"Spartan Protocol (SPARTA) is a cryptocurrency launched in 2020and operates on the BNB Smart Chain (BEP20) platform. Spartan Protocol has a current supply of 74,782,755.88148826. The last known price of Spartan Protocol is 0.00040021 USD and is up 0.00 over the last 24 hours. It is currently trading on 24 active market(s) with $35,785.37 traded over the last 24 hours. More information can be found at https://spartanprotocol.org/.",35781.0,47714.0,35781.0,35781.0,,USD,CoinMarketCap,CoinMarketCap,False,en-US,US,Cryptocurrency,True,HIGH,False,,dApps,Decentralized Finance (DeFi),Decentralized Exchanges (DEX),SPARTA,dApps,Decentralized Finance (DeFi),Decentralized Exchanges (DEX),Cryptocurrency,Spartan Protocol is a decentralized finance (DeFi) protocol built on the Binance Smart Chain (BSC) that focuses on creating synthetic assets and liquidity pools. It uses a pooled lending model and token burns to maintain stability and scarcity.,Spartan Protocol,0.001177 +0.000023 (+1.95%),2.3e-05,+1.95%,88042.0,1223.0,dApps,Decentralized Finance (DeFi),Decentralized Exchanges (DEX),SPARTA,,,Unknown,True
3624,SPA-USD,Sperax USD,1598400000.0,"Sperax (SPA) is a cryptocurrency and operates on the Ethereum platform. Sperax has a current supply of 4,615,267,291.67 with 1,691,682,260.96 in circulation. The last known price of Sperax is 0.01790252 USD and is up 1.76 over the last 24 hours. It is currently trading on 95 active market(s) with $2,031,653.42 traded over the last 24 hours. More information can be found at https://sperax.io/.",2591161.0,6631797.0,2591161.0,2591161.0,,USD,CoinMarketCap,CoinMarketCap,False,en-US,US,Cryptocurrency,True,HIGH,False,,Smart Contract Platform,Decentralized Finance (DeFi),Stablecoins,SPA,Smart Contract Platform,Decentralized Finance (DeFi),Stablecoins,Cryptocurrency,Sperax offers a hybrid financial infrastructure that supports stablecoins and decentralized finance applications. Their focus includes a stablecoin called USDs which is designed to be capital efficient and decentralized.,Sperax,0.014703 -0.000338 (-2.25%),-0.000338,-2.25%,30115000.0,1438000000.0,Smart Contract Platform,Decentralized Finance (DeFi),Stablecoins,SPA,,,Unknown,True
