Unnamed: 0,symbol,shortName,startDate,description_yf,regularMarketVolume,averageVolume,volume24Hr,volumeAllCurrencies,circulatingSupplymarketCap,currency,quoteSourceName,lastMarket,tradeable,language,region,typeDisp,triggerable,customPriceAlertConfidence,cryptoTradeable,trailingPegRatio,level1_x,level2_x,level3_x,ticker,level1_y,level2_y,level3_y,tokenTaxonomy,description_gemini,name,price,change,change_percent,market_cap,volume,level1,level2,level3,ticker_clean,json_ticker,cmc_categories,cmc_categories_str,has_price
990,DBC-USD,DeepBrain Chain USD,1514419200.0,"DeepBrain Chain (DBC) is a cryptocurrency . DeepBrain Chain has a current supply of 10,000,000,000 with 5,428,952,299 in circulation. The last known price of DeepBrain Chain is 0.00213268 USD and is down -0.01 over the last 24 hours. It is currently trading on 14 active market(s) with $159,884.22 traded over the last 24 hours. More information can be found at https://www.deepbrainchain.org/.",151271.0,208158.0,151271.0,151271.0,,USD,CoinMarketCap,CoinMarketCap,False,en-US,US,Cryptocurrency,True,HIGH,False,,dApps,Artificial Intelligence,Decentralized Computing,DBC,dApps,Artificial Intelligence,Decentralized Computing,Cryptocurrency,"DeepBrain Chain is a decentralized AI computing platform. It aims to provide low-cost, private, and secure computing power for AI companies and researchers.",DeepBrain Chain,0.000708 -0.000014 (-1.96%),-1.4e-05,-1.96%,3841000.0,252297.0,dApps,Artificial Intelligence,Decentralized Computing,DBC,,,Unknown,True
1001,DCR-USD,Decred USD,1455062400.0,"Decred (DCR) is a cryptocurrency launched in 2016. Users are able to generate DCR through the process of mining. Decred has a current supply of 16,666,687.00514879. The last known price of Decred is 11.5796912 USD and is down -3.14 over the last 24 hours. It is currently trading on 85 active market(s) with $2,566,146.72 traded over the last 24 hours. More information can be found at https://decred.org/.",1337981.0,2822105.0,1337981.0,1337981.0,,USD,CoinMarketCap,CoinMarketCap,False,en-US,US,Cryptocurrency,True,HIGH,False,,Cryptocurrencies,Infrastructure,Governance,DCR,Cryptocurrencies,Infrastructure,Governance,Cryptocurrency,"Decred is a cryptocurrency with a strong emphasis on community input, open governance, and sustainable funding model. It aims to be a self-ruling, sustainable, and secure cryptocurrency through its hybrid Proof-of-Work (PoW) and Proof-of-Stake (PoS) consensus mechanism.",Decred,17.36 +0.16 (+0.93%),0.16,+0.93%,293858000.0,1649000.0,Cryptocurrencies,Infrastructure,Governance,DCR,DCR,"['Bitcoin Ecosystem', 'Placeholder Ventures Portfolio']",Bitcoin Ecosystem; Placeholder Ventures Portfolio,True
1006,DDX-USD,DerivaDAO USD,1601337600.0,"DerivaDAO (DDX) is a cryptocurrency and operates on the Ethereum platform. DerivaDAO has a current supply of 50,297,306 with 26,094,664 in circulation. The last known price of DerivaDAO is 0.03379472 USD and is up 2.98 over the last 24 hours. It is currently trading on 21 active market(s) with $18.00 traded over the last 24 hours. More information can be found at https://derivadex.com/.",18.0,61.0,18.0,18.0,,USD,CoinMarketCap,CoinMarketCap,False,en-US,US,Cryptocurrency,True,HIGH,False,,dApps,Decentralized Finance (DeFi),Derivatives,DDX,dApps,Decentralized Finance (DeFi),Derivatives,Governance Token,DerivaDAO is a decentralized autonomous organization focused on the development and governance of decentralized derivatives trading. The DDX token is used for governance and incentivization within the DerivaDAO ecosystem.,DerivaDAO,0.011131 -0.000004 (-0.04%),-4e-06,-0.04%,290457.0,32.0,dApps,Decentralized Finance (DeFi),Derivatives,DDX,,,Unknown,True
1021,DEGO-USD,Dego Finance USD,1600300800.0,"Dego Finance (DEGO) is a cryptocurrency and operates on the Ethereum platform. Dego Finance has a current supply of 21,000,000 with 20,997,212.63267069 in circulation. The last known price of Dego Finance is 1.96690477 USD and is down -5.10 over the last 24 hours. It is currently trading on 107 active market(s) with $49,530,553.38 traded over the last 24 hours. More information can be found at https://dego.finance/.",32981150.0,15178583.0,32981150.0,32981150.0,,USD,CoinMarketCap,CoinMarketCap,False,en-US,US,Cryptocurrency,True,HIGH,False,,dApps,Decentralized Finance (DeFi),NFTs & Gaming,DEGO,dApps,Decentralized Finance (DeFi),NFTs & Gaming,Cryptocurrency,"Dego Finance is a decentralized NFT and DeFi protocol and infrastructure, featuring various NFT-related products and tools. It aims to provide an accessible and engaging platform for users to create, collect, and trade NFTs while integrating them into DeFi applications.",Dego Finance,1.1373 -0.0074 (-0.64%),-0.0074,-0.64%,23880000.0,3630000.0,dApps,Decentralized Finance (DeFi),NFTs & Gaming,DEGO,,,Unknown,True
1023,DEM-USD,Deutsche eMark USD,1387065600.0,"Deutsche eMark (DEM) is a cryptocurrency . Users are able to generate DEM through the process of mining. Deutsche eMark has a current supply of 165,212,394.88051617 with 158,230,418.80951616 in circulation. The last known price of Deutsche eMark is 0.00344175 USD and is down -3.50 over the last 24 hours. It is currently trading on 5 active market(s) with $9.50 traded over the last 24 hours. More information can be found at https://deutsche-emark.org/en/.",6.0,164.0,6.0,6.0,,USD,CoinMarketCap,CoinMarketCap,False,en-US,US,Cryptocurrency,True,HIGH,False,,Cryptocurrencies,Infrastructure,Payments,DEM,Cryptocurrencies,Infrastructure,Payments,Cryptocurrency,Deutsche eMark (DEM) is a cryptocurrency designed for online payments and transactions. It aims to provide a fast and secure alternative to traditional payment methods with a focus on German-speaking markets.,Deutsche eMark,0.002365 +0.000002 (+0.10%),2e-06,+0.10%,374210.0,0.0,Cryptocurrencies,Infrastructure,Payments,DEM,,,Unknown,True
1024,DENT-USD,Dent USD,1502496000.0,"Dent (DENT) is a cryptocurrency and operates on the Ethereum platform. Dent has a current supply of 99,999,999,999.9999429. The last known price of Dent is 0.00079399 USD and is down -2.88 over the last 24 hours. It is currently trading on 121 active market(s) with $7,417,178.63 traded over the last 24 hours. More information can be found at https://www.dentwireless.com/.",5786049.0,10849569.0,5786049.0,5786049.0,,USD,CoinMarketCap,CoinMarketCap,False,en-US,US,Cryptocurrency,True,HIGH,False,,dApps,Infrastructure,Telecom,Dent,dApps,Infrastructure,Telecom,Cryptocurrency,"Dent aims to create a global marketplace for mobile data. It allows users to buy, sell, and share mobile data through the Dent marketplace using DENT tokens.",Dent,0.000849 -0.000005 (-0.57%),-5e-06,-0.57%,84876000.0,7932000.0,dApps,Infrastructure,Telecom,DENT,,,Unknown,True
1027,DEP-USD,DEAPcoin USD,1586476800.0,"DEAPcoin (DEP) is a cryptocurrency launched in 2019and operates on the Ethereum platform. DEAPcoin has a current supply of 29,892,900,001.32895446 with 28,726,332,268.32894932 in circulation. The last known price of DEAPcoin is 0.00116439 USD and is down -9.51 over the last 24 hours. It is currently trading on 72 active market(s) with $2,218,103.28 traded over the last 24 hours. More information can be found at https://dea.sg/.",925668.0,1203408.0,925668.0,925668.0,,USD,CoinMarketCap,CoinMarketCap,False,en-US,US,Cryptocurrency,True,HIGH,False,,dApps,Entertainment/Leisure,Gaming,DEP,dApps,Entertainment/Leisure,Gaming,Cryptocurrency,"DEAPcoin is a cryptocurrency used within the PlayMining ecosystem, a platform focused on blockchain-based games and digital entertainment. It serves as the primary currency for in-game purchases, NFT transactions, and other activities within the PlayMining universe.",DEAPcoin,0.001582 -0.000005 (-0.32%),-5e-06,-0.32%,46729000.0,2657000.0,dApps,Entertainment/Leisure,Gaming,DEP,,,Unknown,True
1029,DERO-USD,Dero USD,1524441600.0,"Dero (DERO) is a cryptocurrency . Users are able to generate DERO through the process of mining. Dero has a current supply of 18,400,000 with 14,312,916 in circulation. The last known price of Dero is 0.39094312 USD and is up 13.38 over the last 24 hours. It is currently trading on 15 active market(s) with $33,554.49 traded over the last 24 hours. More information can be found at https://dero.io.",25108.0,21072.0,25108.0,25108.0,,USD,CoinMarketCap,CoinMarketCap,False,en-US,US,Cryptocurrency,True,HIGH,False,,Cryptocurrencies,Infrastructure,Payments,Dero,Cryptocurrencies,Infrastructure,Payments,Cryptocurrency,"Dero is a privacy-focused cryptocurrency that combines a Directed Acyclic Graph (DAG) block structure with CryptoNote technology and TLS encryption, providing fast transactions and strong privacy. It's the first cryptocurrency to combine a DAG block structure with privacy.",Dero,0.492668 +0.000208 (+0.04%),0.000208,+0.04%,7052000.0,11480.0,Cryptocurrencies,Infrastructure,Payments,DERO,,,Unknown,True
1034,DEXA-USD,DEXA COIN USD,1574035200.0,"DEXA COIN (DEXA) is a cryptocurrency launched in 2019and operates on the Ethereum platform. DEXA COIN has a current supply of 100,000,000,000 with 25,000,000,000 in circulation. The last known price of DEXA COIN is 0.00000246 USD and is down -12.82 over the last 24 hours. It is currently trading on 6 active market(s) with $56,609.35 traded over the last 24 hours. More information can be found at https://dexacoin.net/.",62191.0,80140.0,62191.0,62191.0,,USD,CoinMarketCap,CoinMarketCap,False,en-US,US,Cryptocurrency,True,HIGH,False,,Cryptocurrencies,Decentralized Finance (DeFi),Payments,DEXA COIN,Cryptocurrencies,Decentralized Finance (DeFi),Payments,Cryptocurrency,DEXA COIN aims to be a decentralized cryptocurrency focused on providing fast and secure payment solutions within the DeFi ecosystem. It facilitates peer-to-peer transactions and aims to be used in various online and offline payment scenarios.,DEXA COIN,0.00000191 -0.00000001 (-0.64%),-1e-08,-0.64%,47871.0,13425.0,Cryptocurrencies,Decentralized Finance (DeFi),Payments,DEXA,,,Unknown,True
1035,DEXE-USD,DeXe USD,1602028800.0,"DeXe (DEXE) is a cryptocurrency and operates on the Ethereum platform. DeXe has a current supply of 96,504,599.33609451 with 83,733,347.49799644 in circulation. The last known price of DeXe is 18.63253214 USD and is up 2.00 over the last 24 hours. It is currently trading on 109 active market(s) with $7,678,065.22 traded over the last 24 hours. More information can be found at https://dexe.network/.",6233753.0,22278208.0,6233753.0,6233753.0,,USD,CoinMarketCap,CoinMarketCap,False,en-US,US,Cryptocurrency,True,HIGH,False,,dApps,Decentralized Finance (DeFi),Asset Management,DEXE,dApps,Decentralized Finance (DeFi),Asset Management,Cryptocurrency,DeXe is a decentralized autonomous organization (DAO) focused on creating tools for decentralized asset management and trading. It aims to provide a platform for users to create and participate in decentralized social trading and copy trading strategies.,DeXe,7.4409 -0.0005 (-0.01%),-0.0005,-0.01%,623050000.0,5611000.0,dApps,Decentralized Finance (DeFi),Asset Management,DEXE,DEXE,"['Asset Management', 'DAO']",Asset Management; DAO,True
1036,DEXT-USD,DEXTools USD,1595116800.0,"DEXTools (DEXT) is a cryptocurrency launched in 2020and operates on the Ethereum platform. DEXTools has a current supply of 120,551,255 with 77,636,606.78904452 in circulation. The last known price of DEXTools is 0.29767577 USD and is down -2.82 over the last 24 hours. It is currently trading on 40 active market(s) with $7,677.67 traded over the last 24 hours. More information can be found at https://www.dextools.io/.",18589.0,143054.0,18589.0,18589.0,,USD,CoinMarketCap,CoinMarketCap,False,en-US,US,Cryptocurrency,True,HIGH,False,,dApps,Decentralized Finance (DeFi),Trading Tools,DEXT,dApps,Decentralized Finance (DeFi),Trading Tools,Native Currency,"DEXTools provides real-time data analysis and trading tools for decentralized exchanges (DEXs). Its native token, DEXT, is used for accessing premium features and functionalities within the platform, such as advanced analytics and personalized dashboards.",DEXTools,0.412494 -0.011777 (-2.78%),-0.011777,-2.78%,32030000.0,89638.0,dApps,Decentralized Finance (DeFi),Trading Tools,DEXT,DEXT,['Analytics'],Analytics,True
1039,DFD-USD,DefiDollar DAO USD,1604448000.0,"DefiDollar DAO (DFD) is a cryptocurrency and operates on the Ethereum platform. DefiDollar DAO has a current supply of 100,000,000 with 0 in circulation. The last known price of DefiDollar DAO is 0.00729485 USD and is up 0.00 over the last 24 hours. It is currently trading on 7 active market(s) with $0.00 traded over the last 24 hours. More information can be found at https://app.dusd.finance/.",10.0,0.0,10.0,10.0,,USD,CoinMarketCap,CoinMarketCap,False,en-US,US,Cryptocurrency,True,HIGH,False,,dApps,Decentralized Finance (DeFi),Stablecoins,DUSD,dApps,Decentralized Finance (DeFi),Stablecoins,Exogenous/Anchored Stablecoin,"DefiDollar (DUSD) is a decentralized stablecoin pegged to the value of the US dollar. It is collateralized by other stablecoins and managed by the DefiDollar DAO, aiming to provide a more diversified and stable alternative in the DeFi space.",DefiDollar DAO,,,,,,dApps,Decentralized Finance (DeFi),Stablecoins,DFD,,,Unknown,True
1042,DFI-USD,DeFiChain USD,1593734400.0,"DeFiChain (DFI) is a cryptocurrency launched in 2020. DeFiChain has a current supply of 1,149,750,004.0145879 with 828,938,979.5727044 in circulation. The last known price of DeFiChain is 0.00969816 USD and is down -18.54 over the last 24 hours. It is currently trading on 74 active market(s) with $2,463,409.88 traded over the last 24 hours. More information can be found at https://defichain.com/.",1072985.0,1323951.0,1072985.0,1072985.0,,USD,CoinMarketCap,CoinMarketCap,False,en-US,US,Cryptocurrency,True,HIGH,False,,Smart Contract Platform,Decentralized Finance (DeFi),Blockchain Infrastructure for DeFi,DFI,Smart Contract Platform,Decentralized Finance (DeFi),Blockchain Infrastructure for DeFi,Native Currency,"DeFiChain is a decentralized blockchain platform dedicated to providing fast, intelligent, and transparent decentralized financial services. It aims to bring Bitcoin's security and immutability to the DeFi world.",DeFiChain,0.007132 +0.000871 (+13.92%),0.000871,+13.92%,5912000.0,57959.0,Smart Contract Platform,Decentralized Finance (DeFi),Blockchain Infrastructure for DeFi,DFI,,,Unknown,True
1045,DF-USD,dForce USD,1592784000.0,"dForce (DF) is a cryptocurrency launched in 2019and operates on the Ethereum platform. dForce has a current supply of 999,926,146.62751769. The last known price of dForce is 0.07306186 USD and is down -3.40 over the last 24 hours. It is currently trading on 99 active market(s) with $13,615,060.03 traded over the last 24 hours. More information can be found at https://dforce.network/.",6641446.0,23750703.0,6641446.0,6641446.0,,USD,CoinMarketCap,CoinMarketCap,False,en-US,US,Cryptocurrency,True,HIGH,False,,dApps,Decentralized Finance (DeFi),Credit/Lending,DF,dApps,Decentralized Finance (DeFi),Credit/Lending,Cryptocurrency,"dForce is a DeFi protocol providing integrated trading and credit infrastructure. It offers a suite of DeFi protocols covering lending, trading, and stablecoin issuance, aiming to build a cross-chain decentralized finance ecosystem.",dForce,0.031387 +0.000010 (+0.03%),1e-05,+0.03%,31385000.0,2576000.0,dApps,Decentralized Finance (DeFi),Credit/Lending,DF,,,Unknown,True
1049,DGB-USD,DigiByte USD,1391644800.0,"DigiByte (DGB) is a cryptocurrency . Users are able to generate DGB through the process of mining. DigiByte has a current supply of 17,571,778,355.020499. The last known price of DigiByte is 0.00949221 USD and is up 0.76 over the last 24 hours. It is currently trading on 162 active market(s) with $11,513,713.89 traded over the last 24 hours. More information can be found at https://digibyte.org/.",34981328.0,8382892.0,34981328.0,34981328.0,,USD,CoinMarketCap,CoinMarketCap,False,en-US,US,Cryptocurrency,True,HIGH,False,,Cryptocurrencies,Infrastructure,Payments,DGB,Cryptocurrencies,Infrastructure,Payments,Cryptocurrency,"DigiByte is a public, rapidly growing and highly decentralized blockchain. It uses five different cryptographic algorithms to improve security and aims to provide fast transaction speeds.",DigiByte,0.009717 +0.000090 (+0.94%),9e-05,+0.94%,173136000.0,2540000.0,Cryptocurrencies,Infrastructure,Payments,DGB,DGB,['IoT'],IoT,True
1051,DHT-USD,dHedge DAO USD,1600300800.0,"dHedge DAO (DHT) is a cryptocurrency launched in 2020and operates on the Ethereum platform. dHedge DAO has a current supply of 100,000,000 with 57,366,873.87528686 in circulation. The last known price of dHedge DAO is 0.09374294 USD and is down -7.15 over the last 24 hours. It is currently trading on 37 active market(s) with $2,126.21 traded over the last 24 hours. More information can be found at https://www.dhedge.org/.",2236.0,7344.0,2236.0,2236.0,,USD,CoinMarketCap,CoinMarketCap,False,en-US,US,Cryptocurrency,True,HIGH,False,,dApps,Decentralized Finance (DeFi),Asset Management,DHT,dApps,Decentralized Finance (DeFi),Asset Management,Cryptocurrency,"dHedge DAO is a decentralized asset management platform that allows users to create and manage investment pools. DHT is the governance token used for platform upgrades, treasury management, and incentivizing participation.",dHedge DAO,0.150478 +0.001487 (+1.00%),0.001487,+1.00%,8387000.0,2855.0,dApps,Decentralized Finance (DeFi),Asset Management,DHT,,,Unknown,True
1054,DIA-USD,DIA USD,1596499200.0,"DIA (DIA) is a cryptocurrency and operates on the Ethereum platform. DIA has a current supply of 168,817,248 with 119,676,104 in circulation. The last known price of DIA is 0.44696079 USD and is down -3.82 over the last 24 hours. It is currently trading on 133 active market(s) with $9,873,197.64 traded over the last 24 hours. More information can be found at https://diadata.org/.",8121334.0,12757152.0,8121334.0,8121334.0,,USD,CoinMarketCap,CoinMarketCap,False,en-US,US,Cryptocurrency,True,HIGH,False,,dApps,Decentralized Finance (DeFi),Infrastructure,DIA,dApps,Decentralized Finance (DeFi),Infrastructure,Cryptocurrency,"DIA (Decentralized Information Asset) is a decentralized oracle platform that enables market actors to source, supply, and share data for DeFi applications. It aims to provide transparent and verifiable data feeds for smart contracts.",DIA,0.899236 -0.036876 (-3.94%),-0.036876,-3.94%,107617000.0,16463999.999999998,dApps,Decentralized Finance (DeFi),Infrastructure,DIA,DIA,['Oracles'],Oracles,True
1059,DIME-USD,Dimecoin USD,1388966400.0,"Dimecoin (DIME) is a cryptocurrency launched in 2013. Users are able to generate DIME through the process of mining. Dimecoin has a current supply of 581,925,522,437.95853 with 478,333,438,962 in circulation. The last known price of Dimecoin is 0.00000073 USD and is up 10.26 over the last 24 hours. It is currently trading on 16 active market(s) with $17.53 traded over the last 24 hours. More information can be found at https://www.dimecoinnetwork.com/.",85.0,4.0,85.0,85.0,,USD,CoinMarketCap,CoinMarketCap,False,en-US,US,Cryptocurrency,True,HIGH,False,,Cryptocurrencies,Infrastructure,Payments,DIME,Cryptocurrencies,Infrastructure,Payments,Cryptocurrency,Dimecoin is a cryptocurrency designed to facilitate fast and inexpensive transactions. It aims to be a secure and scalable payment method.,Dimecoin,0.00000057 -0.00000010 (-14.58%),-1e-07,-14.58%,274497.0,0.0,Cryptocurrencies,Infrastructure,Payments,DIME,,,Unknown,True
1067,DIP-USD,Etherisc DIP Token USD,1597363200.0,"Etherisc DIP Token (DIP) is a cryptocurrency launched in 2016and operates on the Ethereum platform. Etherisc DIP Token has a current supply of 1,000,000,000 with 239,742,108 in circulation. The last known price of Etherisc DIP Token is 0.01019391 USD and is up 12.09 over the last 24 hours. It is currently trading on 12 active market(s) with $25,634.52 traded over the last 24 hours. More information can be found at https://etherisc.com/.",64.0,4502.0,64.0,64.0,,USD,CoinMarketCap,CoinMarketCap,False,en-US,US,Cryptocurrency,True,HIGH,False,,dApps,Decentralized Finance (DeFi),Insurance,DIP,dApps,Decentralized Finance (DeFi),Insurance,Utility Token,"The Etherisc DIP token is the native utility token of the Etherisc decentralized insurance protocol. It is used for governance, staking, and incentivizing various functions within the Etherisc ecosystem, primarily related to decentralized insurance applications.",Etherisc DIP Token,0.008117 -0.000155 (-1.87%),-0.000155,-1.87%,1946000.0,58.0,dApps,Decentralized Finance (DeFi),Insurance,DIP,DIP,['Insurance'],Insurance,True
1069,DIVI-USD,Divi USD,1539302400.0,"Divi (DIVI) is a cryptocurrency launched in 2018. Users are able to generate DIVI through the process of mining. Divi has a current supply of 4,216,423,449.412663 with 4,216,422,868.412663 in circulation. The last known price of Divi is 0.00143636 USD and is down -0.98 over the last 24 hours. It is currently trading on 16 active market(s) with $141,573.46 traded over the last 24 hours. More information can be found at https://www.diviproject.org/.",139900.0,147326.0,139900.0,139900.0,,USD,CoinMarketCap,CoinMarketCap,False,en-US,US,Cryptocurrency,True,HIGH,False,,Cryptocurrencies,Infrastructure,Payments,Divi,Cryptocurrencies,Infrastructure,Payments,Cryptocurrency,Divi is a cryptocurrency focused on ease of use and mass adoption. It utilizes a proof-of-stake consensus mechanism and offers features like masternodes and staking rewards to incentivize network participation.,Divi,0.001005 +0.000002 (+0.21%),2e-06,+0.21%,4391000.0,55952.0,Cryptocurrencies,Infrastructure,Payments,DIVI,,,Unknown,True
1072,DKA-USD,dKargo USD,1595808000.0,"dKargo (DKA) is a cryptocurrency and operates on the Ethereum platform. dKargo has a current supply of 5,000,000,000 with 4,686,666,667 in circulation. The last known price of dKargo is 0.01821019 USD and is down -1.89 over the last 24 hours. It is currently trading on 25 active market(s) with $1,559,168.92 traded over the last 24 hours. More information can be found at https://dkargo.io/en.",1394767.0,10008647.0,1394767.0,1394767.0,,USD,CoinMarketCap,CoinMarketCap,False,en-US,US,Cryptocurrency,True,HIGH,False,,dApps,Supply Chain,Logistics,dKargo,dApps,Supply Chain,Logistics,Cryptocurrency,"dKargo is a blockchain-based logistics network designed to solve problems of trust, transparency, and efficiency in the logistics industry. It aims to connect fragmented logistics data and participants through a decentralized platform.",dKargo,0.016541 +0.000102 (+0.62%),0.000102,+0.62%,82703000.0,1161000.0,dApps,Supply Chain,Logistics,DKA,,,Unknown,True
1078,DMD-USD,Diamond USD,1387411200.0,"Diamond (DMD) is a cryptocurrency . Diamond has a current supply of 3,854,066.20887093. The last known price of Diamond is 1.52949926 USD and is down -3.92 over the last 24 hours. It is currently trading on 11 active market(s) with $17,062.62 traded over the last 24 hours. More information can be found at http://bit.diamonds.",16073.0,25298.0,16073.0,16073.0,,USD,CoinMarketCap,CoinMarketCap,False,en-US,US,Cryptocurrency,True,HIGH,False,,Cryptocurrencies,Infrastructure,Payments,Diamond,Cryptocurrencies,Infrastructure,Payments,Cryptocurrency,"Diamond is a cryptocurrency that aimed to be a fast and efficient digital currency for online transactions. It sought to provide lower transaction fees compared to traditional payment methods, with a focus on usability and speed.",Diamond,2.2463 -0.0688 (-2.97%),-0.0688,-2.97%,8699000.0,25714.0,Cryptocurrencies,Infrastructure,Payments,DMD,,,Unknown,True
1082,DNT-USD,district0x USD,1501718400.0,"district0x (DNT) is a cryptocurrency and operates on the Ethereum platform. district0x has a current supply of 1,000,000,000. The last known price of district0x is 0.03318279 USD and is up 1.11 over the last 24 hours. It is currently trading on 63 active market(s) with $1,168,112.05 traded over the last 24 hours. More information can be found at https://district0x.io/.",1309895.0,827902.0,1309895.0,1309895.0,,USD,CoinMarketCap,CoinMarketCap,False,en-US,US,Cryptocurrency,True,HIGH,False,,dApps,Infrastructure,Governance,district0x,dApps,Infrastructure,Governance,Cryptocurrency,"district0x is a collective of decentralized marketplaces and communities, powered by the DNT token. It enables the creation and operation of decentralized autonomous organizations (DAOs) through its framework and network of districts.",district0x,0.029505 -0.001495 (-4.82%),-0.001495,-4.82%,29505000.0,835962.0,dApps,Infrastructure,Governance,DNT,,,Unknown,True
1092,DODO-USD,DODO USD,1601337600.0,"DODO (DODO) is a cryptocurrency launched in 2020and operates on the Ethereum platform. DODO has a current supply of 1,000,000,000 with 725,703,404.35 in circulation. The last known price of DODO is 0.07580437 USD and is down -2.82 over the last 24 hours. It is currently trading on 255 active market(s) with $8,566,098.87 traded over the last 24 hours. More information can be found at https://dodoex.io/.",7151247.0,14798771.0,7151247.0,7151247.0,,USD,CoinMarketCap,CoinMarketCap,False,en-US,US,Cryptocurrency,True,HIGH,False,,dApps,Decentralized Finance (DeFi),Decentralized Exchanges (DEX),DODO,dApps,Decentralized Finance (DeFi),Decentralized Exchanges (DEX),Native Currency,DODO is a decentralized exchange (DEX) platform powered by the Proactive Market Maker (PMM) algorithm. It aims to provide better liquidity and price discovery compared to traditional Automated Market Makers (AMMs).,DODO,0.048048 +0.000365 (+0.76%),0.000365,+0.76%,34869000.0,5152000.0,dApps,Decentralized Finance (DeFi),Decentralized Exchanges (DEX),DODO,DODO,['DeFiance Capital Portfolio'],DeFiance Capital Portfolio,True
