Unnamed: 0,symbol,shortName,startDate,description_yf,regularMarketVolume,averageVolume,volume24Hr,volumeAllCurrencies,circulatingSupplymarketCap,currency,quoteSourceName,lastMarket,tradeable,language,region,typeDisp,triggerable,customPriceAlertConfidence,cryptoTradeable,trailingPegRatio,level1_x,level2_x,level3_x,ticker,level1_y,level2_y,level3_y,tokenTaxonomy,description_gemini,name,price,change,change_percent,market_cap,volume,level1,level2,level3,ticker_clean,json_ticker,cmc_categories,cmc_categories_str,has_price
2086,KTON-USD,Darwinia Commitment Token USD,1595894400.0,"Darwinia Commitment Token (KTON) is a cryptocurrency and operates on the Ethereum platform. Darwinia Commitment Token has a current supply of 106,733 with 51,314 in circulation. The last known price of Darwinia Commitment Token is 3.15138684 USD and is down -0.04 over the last 24 hours. It is currently trading on 13 active market(s) with $0.00 traded over the last 24 hours. More information can be found at https://darwinia.network/.",123.0,3335.0,123.0,123.0,,USD,CoinMarketCap,CoinMarketCap,False,en-US,US,Cryptocurrency,True,HIGH,False,,Interoperability,Infrastructure,Cross-Chain Infrastructure,RING,Interoperability,Infrastructure,Cross-Chain Infrastructure,Native Currency,"RING is the native token of the Darwinia Network, a decentralized cross-chain bridge hub built on Substrate. It is used for staking, governance, and transaction fees within the Darwinia ecosystem, facilitating interoperability between heterogeneous blockchains.",Darwinia Commitment Token,3.7800 -0.3283 (-7.99%),-0.3283,-7.99%,193965.0,76361.0,Interoperability,Infrastructure,Cross-Chain Infrastructure,KTON,,,Unknown,True
2106,LAMB-USD,Lambda USD,1546387200.0,"Lambda (LAMB) is a cryptocurrency and operates on the Ethereum platform. Lambda has a current supply of 6,000,000,000 with 1,646,414,198 in circulation. The last known price of Lambda is 0.00116439 USD and is down -2.27 over the last 24 hours. It is currently trading on 51 active market(s) with $321,454.10 traded over the last 24 hours. More information can be found at https://www.lambda.im/.",409508.0,1710318.0,409508.0,409508.0,,USD,CoinMarketCap,CoinMarketCap,False,en-US,US,Cryptocurrency,True,HIGH,False,,Cryptocurrencies,Infrastructure,Decentralized Storage,Lambda,Cryptocurrencies,Infrastructure,Decentralized Storage,Cryptocurrency,"Lambda is a blockchain infrastructure project providing decentralized storage services. It aims to provide secure, scalable, and decentralized data storage infrastructure for decentralized applications (dApps).",Lambda,0.00000968 0.00000000 (0.00%),0.0,0.00%,15930.0,16019.0,Cryptocurrencies,Infrastructure,Decentralized Storage,LAMB,,,Unknown,True
2112,LA-USD,LATOKEN USD,1508889600.0,"LATOKEN (LA) is a cryptocurrency and operates on the Ethereum platform. LATOKEN has a current supply of 400,000,000 with 380,105,462 in circulation. The last known price of LATOKEN is 0.01440259 USD and is down -1.49 over the last 24 hours. It is currently trading on 9 active market(s) with $7,117.07 traded over the last 24 hours. More information can be found at https://latoken.com/.",4837.0,5199.0,4837.0,4837.0,,USD,CoinMarketCap,CoinMarketCap,False,en-US,US,Cryptocurrency,True,HIGH,False,,Cryptocurrencies,Centralized Finance (CeFi),Exchange Tokens,LATOKEN,Cryptocurrencies,Centralized Finance (CeFi),Exchange Tokens,Cryptocurrency,LATOKEN is the native cryptocurrency of the LATOKEN exchange. It is primarily used within the LATOKEN ecosystem for trading fee discounts and participation in IEOs (Initial Exchange Offerings).,LATOKEN,0.018399 -0.000029 (-0.16%),-2.9e-05,-0.16%,6994000.0,71.0,Cryptocurrencies,Centralized Finance (CeFi),Exchange Tokens,LA,LA,['Fenbushi Capital Portfolio'],Fenbushi Capital Portfolio,True
2115,LAYER-USD,UniLayer USD,1597795200.0,"UniLayer (LAYER) is a cryptocurrency and operates on the Ethereum platform. UniLayer has a current supply of 40,000,000 with 29,618,740.51705574 in circulation. The last known price of UniLayer is 0.02347714 USD and is down -2.35 over the last 24 hours. It is currently trading on 17 active market(s) with $22,518.41 traded over the last 24 hours. More information can be found at https://unilayer.com/.",12121.0,109473.0,12121.0,12121.0,,USD,CoinMarketCap,CoinMarketCap,False,en-US,US,Cryptocurrency,True,HIGH,False,,dApps,Decentralized Finance (DeFi),Trading Tools & Infrastructure,UniLayer,dApps,Decentralized Finance (DeFi),Trading Tools & Infrastructure,Cryptocurrency,"UniLayer provides a suite of trading tools and infrastructure for the decentralized finance (DeFi) space, built on top of Uniswap and other decentralized exchanges. It offers advanced trading features such as charting, limit orders, and analytics designed to enhance the trading experience within DeFi.",UniLayer,0.016358 +0.000201 (+1.24%),0.000201,+1.24%,538469.0,49.0,dApps,Decentralized Finance (DeFi),Trading Tools & Infrastructure,LAYER,LAYER,['Restaking'],Restaking,True
2126,LCC-USD,Litecoin Cash USD,1519171200.0,"Litecoin Cash (LCC) is a cryptocurrency . Users are able to generate LCC through the process of mining. Litecoin Cash has a current supply of 810,591,559.3334944. The last known price of Litecoin Cash is 0.00506424 USD and is up 0.00 over the last 24 hours. It is currently trading on 9 active market(s) with $0.00 traded over the last 24 hours. More information can be found at https://litecoinca.sh/.",1.0,37.0,1.0,1.0,,USD,CoinMarketCap,CoinMarketCap,False,en-US,US,Cryptocurrency,True,HIGH,False,,Cryptocurrencies,Infrastructure,Payments,Litecoin Cash,Cryptocurrencies,Infrastructure,Payments,Cryptocurrency,"Litecoin Cash is a fork of Litecoin that aims to provide faster and cheaper transactions. It utilizes a different hashing algorithm than Litecoin and Bitcoin, called SHA256.",Litecoin Cash,0.005908 0.000000 (0.00%),0.0,0.00%,4816000.0,19.0,Cryptocurrencies,Infrastructure,Payments,LCC,,,Unknown,True
2130,LCX-USD,LCX USD,1575331200.0,"LCX (LCX) is a cryptocurrency launched in 2019and operates on the Ethereum platform. LCX has a current supply of 950,000,000 with 771,584,751 in circulation. The last known price of LCX is 0.17088059 USD and is down -4.10 over the last 24 hours. It is currently trading on 94 active market(s) with $1,656,960.19 traded over the last 24 hours. More information can be found at https://www.lcx.com.",2297741.0,2032987.0,2297741.0,2297741.0,,USD,CoinMarketCap,CoinMarketCap,False,en-US,US,Cryptocurrency,True,HIGH,False,,Cryptocurrencies,Centralized Finance (CeFi),Exchange Tokens,LCX,Cryptocurrencies,Centralized Finance (CeFi),Exchange Tokens,Cryptocurrency,"LCX is the native token of the Liechtenstein Cryptoassets Exchange, a regulated exchange for security tokens and other crypto assets. It is used to pay fees on the LCX platform and participate in the LCX ecosystem.",LCX,0.117841 -0.000360 (-0.30%),-0.00036,-0.30%,111058000.0,510853.0,Cryptocurrencies,Centralized Finance (CeFi),Exchange Tokens,LCX,,,Unknown,True
2133,LEAD-USD,Lead Wallet USD,1599523200.0,"Lead Wallet (LEAD) is a cryptocurrency launched in 2020and operates on the Ethereum platform. Lead Wallet has a current supply of 964,310,845.9547057 with 505,310,846 in circulation. The last known price of Lead Wallet is 0.0000023 USD and is up 6.74 over the last 24 hours. It is currently trading on 14 active market(s) with $0.00 traded over the last 24 hours. More information can be found at https://www.leadwallet.io.",10.0,23.0,10.0,10.0,,USD,CoinMarketCap,CoinMarketCap,False,en-US,US,Cryptocurrency,True,HIGH,False,,dApps,Decentralized Finance (DeFi),Wallet,Lead Wallet,dApps,Decentralized Finance (DeFi),Wallet,Cryptocurrency,Lead Wallet is a multi-chain crypto wallet designed for managing digital assets. It aims to provide a secure and user-friendly experience for DeFi users across various blockchain networks.,Lead Wallet,0.00000409 +0.00000006 (+1.49%),6e-08,+1.49%,2064.0,9.0,dApps,Decentralized Finance (DeFi),Wallet,LEAD,,,Unknown,True
2142,LEO-USD,UNUS SED LEO USD,1558396800.0,"UNUS SED LEO (LEO) is a cryptocurrency and operates on the Ethereum platform. UNUS SED LEO has a current supply of 985,239,504 with 923,986,091.9 in circulation. The last known price of UNUS SED LEO is 9.83781381 USD and is down -0.88 over the last 24 hours. It is currently trading on 57 active market(s) with $3,359,273.38 traded over the last 24 hours. More information can be found at https://www.bitfinex.com/.",1917164.0,1889137.0,1917164.0,1917164.0,,USD,CoinMarketCap,CoinMarketCap,False,en-US,US,Cryptocurrency,True,HIGH,False,,Cryptocurrencies,Centralized Finance (CeFi),Exchange Tokens,UNUS SED LEO,Cryptocurrencies,Centralized Finance (CeFi),Exchange Tokens,Cryptocurrency,"UNUS SED LEO is a utility token created by iFinex, the parent company of Bitfinex. It's designed to reduce trading fees and provide other benefits within the Bitfinex ecosystem.",UNUS SED LEO,8.9807 -0.0019 (-0.02%),-0.0019,-0.02%,8289999999.999999,1731000.0,Cryptocurrencies,Centralized Finance (CeFi),Exchange Tokens,LEO,LEO,"['Marketplace', 'Zodiac-Themed', 'Alameda Research Portfolio', 'Ethereum Ecosystem', 'Kenetic Capital Portfolio']",Marketplace; Zodiac-Themed; Alameda Research Portfolio; Ethereum Ecosystem; Kenetic Capital Portfolio,True
2147,LET-USD,LinkEye USD,1516838400.0,"LinkEye (LET) is a cryptocurrency and operates on the Ethereum platform. LinkEye has a current supply of 1,000,000,000 with 0 in circulation. The last known price of LinkEye is 0.00034439 USD and is down -0.22 over the last 24 hours. It is currently trading on 11 active market(s) with $0.00 traded over the last 24 hours. More information can be found at http://www.linkeye.com/.",0.0,4.0,0.0,0.0,,USD,CoinMarketCap,CoinMarketCap,False,en-US,US,Cryptocurrency,True,HIGH,False,,dApps,Decentralized Finance (DeFi),Credit/Lending,LinkEye,dApps,Decentralized Finance (DeFi),Credit/Lending,Cryptocurrency,"LinkEye aimed to build a blockchain-based credit data sharing alliance in China, utilizing the LET token to incentivize data sharing and access. The project intended to connect various credit data providers and consumers on a decentralized platform.",LinkEye,,,,,,dApps,Decentralized Finance (DeFi),Credit/Lending,LET,,,Unknown,True
2154,LGCY-USD,LGCY Network USD,1597968000.0,"LGCY Network (LGCY) is a cryptocurrency and operates on the Ethereum platform. LGCY Network has a current supply of 100,000,000,000 with 12,714,000,000 in circulation. The last known price of LGCY Network is 0.0000008 USD and is up 0.00 over the last 24 hours. It is currently trading on 11 active market(s) with $0.00 traded over the last 24 hours. More information can be found at https://lgcy.network/.",312.0,82.0,312.0,312.0,,USD,CoinMarketCap,CoinMarketCap,False,en-US,US,Cryptocurrency,True,HIGH,False,,Smart Contract Platform,Infrastructure,Infrastructure,LGCY Network,Smart Contract Platform,Infrastructure,Infrastructure,Native Currency,"LGCY Network aimed to be a decentralized blockchain platform with a focus on scalability and governance. The network intended to provide an infrastructure for dApp development and other blockchain-based solutions, however the project is largely defunct.",LGCY Network,0.00000112 +0.00000006 (+5.41%),6e-08,+5.41%,14262.0,4.0,Smart Contract Platform,Infrastructure,Infrastructure,LGCY,,,Unknown,True
2163,LINA7102-USD,Linear Finance USD,1600387200.0,"Linear Finance (LINA) is a cryptocurrency and operates on the Ethereum platform. Linear Finance has a current supply of 10,000,000,000 with 7,702,068,006.32019445 in circulation. The last known price of Linear Finance is 0.00203686 USD and is down -3.83 over the last 24 hours. It is currently trading on 207 active market(s) with $9,825,648.47 traded over the last 24 hours. More information can be found at https://linear.finance.",7255305.0,13792045.0,7255305.0,7255305.0,,USD,CoinMarketCap,CoinMarketCap,False,en-US,US,Cryptocurrency,True,HIGH,False,,dApps,Decentralized Finance (DeFi),Synthetic Assets,LINA,dApps,Decentralized Finance (DeFi),Synthetic Assets,Cryptocurrency,"Linear Finance is a decentralized delta-one asset protocol capable of instantly creating liquid synthetic assets (Liquids). It allows users to build and trade Liquids based on cryptocurrencies, commodities, and indices.",Linear Finance,0.000035 +0.000001 (+2.04%),1e-06,+2.04%,354850.0,126829.0,dApps,Decentralized Finance (DeFi),Synthetic Assets,LINA7102,,,Unknown,True
2164,LINKA-USD,LINKA USD,1572566400.0,"LINKA (LINKA) is a cryptocurrency and operates on the Ethereum platform. LINKA has a current supply of 2,000,000,000 with 694,150,020 in circulation. The last known price of LINKA is 0.00030967 USD and is down -3.45 over the last 24 hours. It is currently trading on 3 active market(s) with $16,526.73 traded over the last 24 hours. More information can be found at https://www.linka.io/.",16588.0,19190.0,16588.0,16588.0,,USD,CoinMarketCap,CoinMarketCap,False,en-US,US,Cryptocurrency,True,HIGH,False,,Smart Contract Platform,Infrastructure,Infrastructure,LINKA,Smart Contract Platform,Infrastructure,Infrastructure,Native Currency,Linka Blockchain aims to provide a scalable and secure platform for decentralized applications. It utilizes a unique consensus mechanism and focuses on interoperability with other blockchains.,LINKA,0.000438 +0.000000 (+0.10%),0.0,+0.10%,303704.0,23353.0,Smart Contract Platform,Infrastructure,Infrastructure,LINKA,,,Unknown,True
2166,LINK-USD,Chainlink USD,1505865600.0,"Chainlink (LINK) is a cryptocurrency and operates on the Ethereum platform. Chainlink has a current supply of 1,000,000,000 with 638,099,970.45278671 in circulation. The last known price of Chainlink is 15.32418352 USD and is down -10.41 over the last 24 hours. It is currently trading on 1939 active market(s) with $868,499,817.16 traded over the last 24 hours. More information can be found at https://chain.link/.",435069504.0,974863860.0,435069504.0,435069504.0,,USD,CoinMarketCap,CoinMarketCap,False,en-US,US,Cryptocurrency,True,HIGH,True,,Interoperability,Infrastructure,Oracle Services,LINK,Interoperability,Infrastructure,Oracle Services,Cryptocurrency,"Chainlink is a decentralized oracle network that provides real-world data to smart contracts on various blockchains. It enables smart contracts to securely access off-chain data feeds, web APIs, and traditional bank payments.",Chainlink,18.84 +0.49 (+2.66%),0.49,+2.66%,12777000000.0,550334000.0,Interoperability,Infrastructure,Oracle Services,LINK,LINK,"['Aptos Ecosystem', 'Made in America', 'SUI Ecosystem', 'Sonic Ecosystem', 'Framework Ventures Portfolio', 'Fantom Ecosystem', 'Injective Ecosystem', 'Near Protocol Ecosystem', 'Cronos Ecosystem', 'Interoperability', 'Ethereum Ecosystem', 'Linea Ecosystem', 'Oasis Ecosystem', 'TRON Ecosystem', 'Solana Ecosystem', 'Corn Ecosystem', 'WLFI Ecosystem', 'Smart Contracts', 'SEI Ecosystem', 'Base Ecosystem', 'BTCfi', 'BNB Chain Ecosystem', 'xStocks Ecosystem', 'Arbitrum Ecosystem', 'Hyperliquid Ecosystem', 'MetisDAO Ecosystem', 'Polkadot Ecosystem', 'zkSync Era Ecosystem', 'Cosmos Ecosystem', 'Optimism Ecosystem', 'Tokenized Assets', 'Bitcoin Ecosystem', 'World Liberty Financial Portfolio', 'Polygon Ecosystem', 'X Layer Ecosystem', 'Tokenized Stock', 'Real World Assets Protocols', 'Cardano Ecosystem', 'Avalanche Ecosystem', 'Oracles', 'DeFi', 'Plasma Ecosystem', 'Blast Ecosystem']",Aptos Ecosystem; Made in America; SUI Ecosystem; Sonic Ecosystem; Framework Ventures Portfolio; Fantom Ecosystem; Injective Ecosystem; Near Protocol Ecosystem; Cronos Ecosystem; Interoperability; Ethereum Ecosystem; Linea Ecosystem; Oasis Ecosystem; TRON Ecosystem; Solana Ecosystem; Corn Ecosystem; WLFI Ecosystem; Smart Contracts; SEI Ecosystem; Base Ecosystem; BTCfi; BNB Chain Ecosystem; xStocks Ecosystem; Arbitrum Ecosystem; Hyperliquid Ecosystem; MetisDAO Ecosystem; Polkadot Ecosystem; zkSync Era Ecosystem; Cosmos Ecosystem; Optimism Ecosystem; Tokenized Assets; Bitcoin Ecosystem; World Liberty Financial Portfolio; Polygon Ecosystem; X Layer Ecosystem; Tokenized Stock; Real World Assets Protocols; Cardano Ecosystem; Avalanche Ecosystem; Oracles; DeFi; Plasma Ecosystem; Blast Ecosystem,True
2196,LOCUS-USD,Locus Chain USD,1558310400.0,"Locus Chain (LOCUS) is a cryptocurrency launched in 2018and operates on the Ethereum platform. Locus Chain has a current supply of 7,000,000,000 with 2,081,062,787.3474767 in circulation. The last known price of Locus Chain is 0.01824135 USD and is down -0.45 over the last 24 hours. It is currently trading on 11 active market(s) with $157,586.90 traded over the last 24 hours. More information can be found at https://locuschain.com/.",172692.0,282922.0,172692.0,172692.0,,USD,CoinMarketCap,CoinMarketCap,False,en-US,US,Cryptocurrency,True,HIGH,False,,Smart Contract Platform,Infrastructure,Infrastructure,Locus Chain,Smart Contract Platform,Infrastructure,Infrastructure,Native Currency,"Locus Chain is a next-generation blockchain platform designed for scalability and accessibility. It aims to provide a distributed ledger technology for various applications, emphasizing speed and efficiency in transaction processing.",Locus Chain,0.015008 +0.000078 (+0.52%),7.8e-05,+0.52%,31233000.0,380463.0,Smart Contract Platform,Infrastructure,Infrastructure,LOCUS,,,Unknown,True
2205,LON-USD,Tokenlon Network Token USD,1608681600.0,"Tokenlon Network Token (LON) is a cryptocurrency launched in 2020and operates on the Ethereum platform. Tokenlon Network Token has a current supply of 140,451,028.83876701 with 116,883,716.69009266 in circulation. The last known price of Tokenlon Network Token is 0.76658511 USD and is down -0.69 over the last 24 hours. It is currently trading on 50 active market(s) with $16,242.14 traded over the last 24 hours. More information can be found at https://tokenlon.im/lon.",14864.0,144312.0,14864.0,14864.0,,USD,CoinMarketCap,CoinMarketCap,False,en-US,US,Cryptocurrency,True,HIGH,False,,dApps,Decentralized Finance (DeFi),Decentralized Exchanges (DEX),LON,dApps,Decentralized Finance (DeFi),Decentralized Exchanges (DEX),Governance Token,"LON is the governance and utility token for Tokenlon, a decentralized exchange and wallet. It allows users to participate in the governance of the Tokenlon protocol and may be used for other utilities within the ecosystem, such as fee reductions.",Tokenlon Network Token,0.765606 -0.000315 (-0.04%),-0.000315,-0.04%,95220000.0,86907.0,dApps,Decentralized Finance (DeFi),Decentralized Exchanges (DEX),LON,,,Unknown,True
2207,LOOM-USD,Loom Network USD,1520985600.0,"Loom Network (LOOM) is a cryptocurrency and operates on the Ethereum platform. Loom Network has a current supply of 1,300,000,000 with 1,242,920,897.57903986 in circulation. The last known price of Loom Network is 0.04185199 USD and is down -1.16 over the last 24 hours. It is currently trading on 166 active market(s) with $1,640,573.37 traded over the last 24 hours. More information can be found at https://loomx.io/.",1211518.0,6801446.0,1211518.0,1211518.0,,USD,CoinMarketCap,CoinMarketCap,False,en-US,US,Cryptocurrency,True,HIGH,False,,Interoperability,Infrastructure,Layer 2 Scaling,LOOM,Interoperability,Infrastructure,Layer 2 Scaling,Native Currency,Loom Network was a platform as a service (PaaS) built on top of Ethereum that allowed developers to run large-scale decentralized applications. It aimed to provide scalability through sidechains and interchain operability via its Delegated Proof of Stake (DPoS) consensus mechanism.,Loom Network,0.001808 -0.000142 (-7.26%),-0.000142,-7.26%,2247000.0,552337.0,Interoperability,Infrastructure,Layer 2 Scaling,LOOM,,,Unknown,True
2215,LPT-USD,Livepeer USD,1545177600.0,"Livepeer (LPT) is a cryptocurrency and operates on the Ethereum platform. Livepeer has a current supply of 38,673,366.15733854. The last known price of Livepeer is 5.93111933 USD and is down -3.26 over the last 24 hours. It is currently trading on 240 active market(s) with $20,417,170.11 traded over the last 24 hours. More information can be found at https://livepeer.org/.",16680582.0,67847805.0,16680582.0,16680582.0,,USD,CoinMarketCap,CoinMarketCap,False,en-US,US,Cryptocurrency,True,HIGH,False,,dApps,Infrastructure,Decentralized Video Infrastructure,Livepeer,dApps,Infrastructure,Decentralized Video Infrastructure,Cryptocurrency,Livepeer is a decentralized video transcoding network built on the Ethereum blockchain. It allows users to contribute their computing power to transcode video and earn LPT tokens.,Livepeer,7.0408 +0.1369 (+1.98%),0.1369,+1.98%,301299000.0,20004000.0,dApps,Infrastructure,Decentralized Video Infrastructure,LPT,LPT,"['Video', 'Harmony Ecosystem', 'Coinfund Portfolio', 'Media', 'Generative AI']",Video; Harmony Ecosystem; Coinfund Portfolio; Media; Generative AI,True
2220,LRC-USD,Loopring USD,1504051200.0,"Loopring (LRC) is a cryptocurrency launched in 2017and operates on the Ethereum platform. Loopring has a current supply of 1,373,873,397.44245744 with 1,366,825,863.50986512 in circulation. The last known price of Loopring is 0.10924678 USD and is down -2.93 over the last 24 hours. It is currently trading on 385 active market(s) with $16,753,958.38 traded over the last 24 hours. More information can be found at https://loopring.org.",12422077.0,23767125.0,12422077.0,12422077.0,,USD,CoinMarketCap,CoinMarketCap,False,en-US,US,Cryptocurrency,True,HIGH,False,,dApps,Decentralized Finance (DeFi),Decentralized Exchanges (DEX),LRC,dApps,Decentralized Finance (DeFi),Decentralized Exchanges (DEX),Native Currency,Loopring is a layer-2 scaling protocol that enables the building of decentralized exchanges (DEXs). It aims to improve the speed and reduce the costs of trading on Ethereum by using zero-knowledge rollups (zkRollups).,Loopring,0.092429 +0.000190 (+0.21%),0.00019,+0.21%,126357000.0,10177000.0,dApps,Decentralized Finance (DeFi),Decentralized Exchanges (DEX),LRC,LRC,"['Layer 2', 'Rollups', 'Scaling', 'Wallet', 'Modular Blockchain']",Layer 2; Rollups; Scaling; Wallet; Modular Blockchain,True
2227,LSK-USD,Lisk USD,1459900800.0,"Lisk (LSK) is a cryptocurrency launched in 2016. Lisk has a current supply of 400,000,000 with 168,500,295.46849605 in circulation. The last known price of Lisk is 0.59969021 USD and is down -2.62 over the last 24 hours. It is currently trading on 136 active market(s) with $18,047,766.43 traded over the last 24 hours. More information can be found at https://Lisk.com/.",13011353.0,33735455.0,13011353.0,13011353.0,,USD,CoinMarketCap,CoinMarketCap,False,en-US,US,Cryptocurrency,True,HIGH,False,,Smart Contract Platform,Infrastructure,Infrastructure,LSK,Smart Contract Platform,Infrastructure,Infrastructure,Native Currency,Lisk is a blockchain application platform that aims to make blockchain technology more accessible through the use of sidechains and JavaScript. It allows developers to build decentralized applications (dApps) using the Lisk SDK and deploy them on their own sidechains.,Lisk,0.480352 +0.012509 (+2.67%),0.012509,+2.67%,94909000.0,4114000.0,Smart Contract Platform,Infrastructure,Infrastructure,LSK,,,Unknown,True
2230,LTC-USD,Litecoin USD,1367107200.0,"Litecoin (LTC) is a cryptocurrency . Users are able to generate LTC through the process of mining. Litecoin has a current supply of 84,000,000 with 75,558,468.3040892 in circulation. The last known price of Litecoin is 104.41609754 USD and is up 0.70 over the last 24 hours. It is currently trading on 1323 active market(s) with $873,300,115.50 traded over the last 24 hours. More information can be found at https://litecoin.org/.",618440576.0,1098767328.0,618440576.0,618440576.0,,USD,CoinMarketCap,CoinMarketCap,False,en-US,US,Cryptocurrency,True,HIGH,True,,Cryptocurrencies,Infrastructure,Payments,LTC,Cryptocurrencies,Infrastructure,Payments,Cryptocurrency,"Litecoin is a peer-to-peer cryptocurrency and open-source software project. It was designed to be a faster and more efficient alternative to Bitcoin, with faster transaction confirmation times and a different hashing algorithm.",Litecoin,113.61 -0.37 (-0.33%),-0.37,-0.33%,8648000000.0,515663000.0,Cryptocurrencies,Infrastructure,Payments,LTC,,,Unknown,True
2232,LTO-USD,LTO Network USD,1549324800.0,"LTO Network (LTO) is a cryptocurrency launched in 2019. LTO Network has a current supply of 436,690,791.1876698. The last known price of LTO Network is 0.06652336 USD and is down -4.01 over the last 24 hours. It is currently trading on 90 active market(s) with $850,586.62 traded over the last 24 hours. More information can be found at https://www.ltonetwork.com/.",744950.0,2248251.0,744950.0,744950.0,,USD,CoinMarketCap,CoinMarketCap,False,en-US,US,Cryptocurrency,True,HIGH,False,,Blockchain Services Platform,Infrastructure,Blockchain-as-a-Service,LTO Network,Blockchain Services Platform,Infrastructure,Blockchain-as-a-Service,Native Currency,"LTO Network provides a hybrid blockchain platform designed for securing, verifying, and exchanging business-critical data. It combines a public, permissionless blockchain with private permissioned chains for GDPR compliance and scalability.",LTO Network,0.004242 -0.000238 (-5.31%),-0.000238,-5.31%,1865000.0,117748.0,Blockchain Services Platform,Infrastructure,Blockchain-as-a-Service,LTO,LTO,['DAO Maker'],DAO Maker,True
