Unnamed: 0,symbol,shortName,startDate,description_yf,regularMarketVolume,averageVolume,volume24Hr,volumeAllCurrencies,circulatingSupplymarketCap,currency,quoteSourceName,lastMarket,tradeable,language,region,typeDisp,triggerable,customPriceAlertConfidence,cryptoTradeable,trailingPegRatio,level1_x,level2_x,level3_x,ticker,level1_y,level2_y,level3_y,tokenTaxonomy,description_gemini,name,price,change,change_percent,market_cap,volume,level1,level2,level3,ticker_clean,json_ticker,cmc_categories,cmc_categories_str,has_price
1,0XBTC-USD,0xBitcoin USD,1528070400.0,"0xBitcoin (0xBTC) is a cryptocurrency and operates on the Ethereum platform. Users are able to generate 0xBTC through the process of mining. 0xBitcoin has a current supply of 9,706,750. The last known price of 0xBitcoin is 0.17824768 USD and is down -0.25 over the last 24 hours. It is currently trading on 26 active market(s) with $78,621.86 traded over the last 24 hours. More information can be found at https://0xbitcoin.org/.",243.0,97856.0,243.0,243.0,,USD,CoinMarketCap,CoinMarketCap,False,en-US,US,Cryptocurrency,True,HIGH,False,,Cryptocurrencies,Infrastructure,Payments,0xBTC,Cryptocurrencies,Infrastructure,Payments,Cryptocurrency,"0xBitcoin is an ERC-20 token designed to function similarly to Bitcoin on the Ethereum network, with a Proof-of-Work mining algorithm. It aims to provide a decentralized and permissionless digital asset that can be earned through mining.",0xBitcoin,0.242132 -0.006162 (-2.48%),-0.006162,-2.48%,2350000.0,1.0,Cryptocurrencies,Infrastructure,Payments,0XBTC,,,Unknown,True
7,1INCH-USD,1inch Network USD,1608854400.0,"1inch Network (1INCH) is a cryptocurrency launched in 2020and operates on the Ethereum platform. 1inch Network has a current supply of 1,500,000,000 with 1,376,265,891.3170378 in circulation. The last known price of 1inch Network is 0.22468586 USD and is down -3.94 over the last 24 hours. It is currently trading on 521 active market(s) with $24,056,001.82 traded over the last 24 hours. More information can be found at https://1inch.io/.",17926382.0,52330341.0,17926382.0,17926382.0,,USD,CoinMarketCap,CoinMarketCap,False,en-US,US,Cryptocurrency,True,HIGH,False,,dApps,Decentralized Finance (DeFi),Decentralized Exchanges (DEX),1INCH,dApps,Decentralized Finance (DeFi),Decentralized Exchanges (DEX),Cryptocurrency,"1inch Network is a decentralized exchange (DEX) aggregator, sourcing liquidity from various exchanges to provide users with the best possible rates. The 1INCH token is used for governance and staking within the 1inch ecosystem.",1inch Network,0.286253 +0.003079 (+1.09%),0.003079,+1.09%,399410000.0,15593000.0,dApps,Decentralized Finance (DeFi),Decentralized Exchanges (DEX),1INCH,1INCH,"['Fabric Ventures Portfolio', 'Celsius Bankruptcy Estate', 'ParaFi Capital', 'Spartan Group', 'DragonFly Capital Portfolio', 'Wallet', 'AMM']",Fabric Ventures Portfolio; Celsius Bankruptcy Estate; ParaFi Capital; Spartan Group; DragonFly Capital Portfolio; Wallet; AMM,True
28,AAVE-USD,Aave USD,1601596800.0,"Aave (AAVE) is a cryptocurrency and operates on the Ethereum platform. Aave has a current supply of 16,000,000 with 15,086,438.10197601 in circulation. The last known price of Aave is 185.99521911 USD and is down -10.19 over the last 24 hours. It is currently trading on 1021 active market(s) with $329,200,129.85 traded over the last 24 hours. More information can be found at https://aave.com/.",288394144.0,628531539.0,288394144.0,288394144.0,,USD,CoinMarketCap,CoinMarketCap,False,en-US,US,Cryptocurrency,True,HIGH,True,,dApps,Decentralized Finance (DeFi),Credit/Lending,Aave,dApps,Decentralized Finance (DeFi),Credit/Lending,Cryptocurrency,"Aave is a decentralized non-custodial liquidity protocol where users can participate as depositors or borrowers. Depositors provide liquidity to the market to earn a passive income, while borrowers are able to borrow in an overcollateralized (perpetually) or undercollateralized (one-block liquidity) fashion.",Aave,296.23 -0.94 (-0.32%),-0.94,-0.32%,4503000000.0,299489000.0,dApps,Decentralized Finance (DeFi),Credit/Lending,AAVE,AAVE,"['Standard Crypto Portfolio', 'DeFi', 'Alameda Research Portfolio', 'Framework Ventures Portfolio', 'Blockchain Capital Portfolio', 'Fantom Ecosystem', 'Near Protocol Ecosystem', 'Governance', 'Solana Ecosystem', 'Three Arrows Capital Portfolio', 'Arbitrum Ecosystem', 'Optimism Ecosystem', 'World Liberty Financial Portfolio', 'DAO', 'Polygon Ecosystem', 'Yield Farming', 'Pantera Capital Portfolio', 'HECO Ecosystem', 'Avalanche Ecosystem', 'ParaFi Capital', 'DeFiance Capital Portfolio', 'Ethereum Ecosystem']",Standard Crypto Portfolio; DeFi; Alameda Research Portfolio; Framework Ventures Portfolio; Blockchain Capital Portfolio; Fantom Ecosystem; Near Protocol Ecosystem; Governance; Solana Ecosystem; Three Arrows Capital Portfolio; Arbitrum Ecosystem; Optimism Ecosystem; World Liberty Financial Portfolio; DAO; Polygon Ecosystem; Yield Farming; Pantera Capital Portfolio; HECO Ecosystem; Avalanche Ecosystem; ParaFi Capital; DeFiance Capital Portfolio; Ethereum Ecosystem,True
31,ABBC-USD,ABBC Coin USD,1539302400.0,"ABBC Coin (ABBC) is a cryptocurrency launched in 2017. ABBC Coin has a current supply of 907,217,636.86000007 with 905,304,095.68614832 in circulation. The last known price of ABBC Coin is 0.00463251 USD and is down -1.55 over the last 24 hours. It is currently trading on 93 active market(s) with $27,466.82 traded over the last 24 hours. More information can be found at https://abbccoin.com/.",22204.0,12857.0,22204.0,22204.0,,USD,CoinMarketCap,CoinMarketCap,False,en-US,US,Cryptocurrency,True,HIGH,False,,Cryptocurrencies,Centralized Finance (CeFi),Payments,ABBC,Cryptocurrencies,Centralized Finance (CeFi),Payments,Cryptocurrency,"ABBC Coin aimed to facilitate secure and efficient cryptocurrency transactions, particularly for online shopping. It initially focused on integrating various exchanges and payment gateways but has faced controversy regarding its technology and claims.",ABBC Coin,0.009790 -0.000309 (-3.06%),-0.000309,-3.06%,8863000.0,56641.0,Cryptocurrencies,Centralized Finance (CeFi),Payments,ABBC,,,Unknown,True
37,ABT-USD,Arcblock USD,1519603200.0,"Arcblock (ABT) is a cryptocurrency and operates on the Ethereum platform. Arcblock has a current supply of 186,000,000 with 98,554,305.44029327 in circulation. The last known price of Arcblock is 0.81055065 USD and is down -9.49 over the last 24 hours. It is currently trading on 39 active market(s) with $990,038.84 traded over the last 24 hours. More information can be found at https://www.arcblock.io/.",484660.0,1701389.0,484660.0,484660.0,,USD,CoinMarketCap,CoinMarketCap,False,en-US,US,Cryptocurrency,True,HIGH,False,,Interoperability,Infrastructure,Blockchain-as-a-Service,Arcblock,Interoperability,Infrastructure,Blockchain-as-a-Service,Native Currency,Arcblock is a blockchain platform designed to connect decentralized applications (dApps) and services. It aims to enable interoperability between different blockchains and build a decentralized ecosystem.,Arcblock,0.888600 +0.012218 (+1.39%),0.012218,+1.39%,87575000.0,696041.0,Interoperability,Infrastructure,Blockchain-as-a-Service,ABT,,,Unknown,True
38,ABYSS-USD,Abyss USD,1528329600.0,"Abyss (ABYSS) is a cryptocurrency launched in 2018and operates on the Ethereum platform. Abyss has a current supply of 508,628,132.04106947 with 228,674,838.84912439 in circulation. The last known price of Abyss is 0.00471229 USD and is down -3.30 over the last 24 hours. It is currently trading on 17 active market(s) with $0.00 traded over the last 24 hours. More information can be found at https://abyss.finance.",0.0,0.0,0.0,0.0,,USD,CoinMarketCap,CoinMarketCap,False,en-US,US,Cryptocurrency,True,HIGH,False,,dApps,Entertainment/Leisure,Gaming,Abyss,dApps,Entertainment/Leisure,Gaming,Cryptocurrency,The Abyss is a digital distribution platform and MMO-focused cryptocurrency-based ecosystem. It aims to offer gamers various earning opportunities and developers enhanced tools and support.,Abyss,0.006033 +0.000051 (+0.86%),5.1e-05,+0.86%,1382000.0,0.0,dApps,Entertainment/Leisure,Gaming,ABYSS,,,Unknown,True
44,ACES-USD,Aces USD,1471564800.0,Aces (ACES) is a cryptocurrency . Aces has a current supply of 0. The last known price of Aces is 0.00098272 USD and is up 0.00 over the last 24 hours. It is currently trading on 1 active market(s) with $0.00 traded over the last 24 hours.,3.0,0.0,3.0,3.0,,USD,CoinMarketCap,CoinMarketCap,False,en-US,US,Cryptocurrency,True,HIGH,False,,Cryptocurrencies,Entertainment/Leisure,Gambling/Gaming,ACES,Cryptocurrencies,Entertainment/Leisure,Gambling/Gaming,Cryptocurrency,Aces is a cryptocurrency designed to be used within online gambling and gaming platforms. It aims to provide a decentralized and transparent payment method for these industries.,Aces,0.000983 0.000000 (0.00%),0.0,0.00%,0.0,3.0,Cryptocurrencies,Entertainment/Leisure,Gambling/Gaming,ACES,,,Unknown,True
46,ACH-USD,Alchemy Pay USD,1599609600.0,"Alchemy Pay (ACH) is a cryptocurrency and operates on the Ethereum platform. Alchemy Pay has a current supply of 9,999,999,999.99998777 with 8,775,704,520.40447805 in circulation. The last known price of Alchemy Pay is 0.02494994 USD and is down -0.55 over the last 24 hours. It is currently trading on 229 active market(s) with $49,972,446.48 traded over the last 24 hours. More information can be found at https://alchemypay.org/.",39585124.0,96407479.0,39585124.0,39585124.0,,USD,CoinMarketCap,CoinMarketCap,False,en-US,US,Cryptocurrency,True,HIGH,False,,Cryptocurrencies,Centralized Finance (CeFi),Payments,ACH,Cryptocurrencies,Centralized Finance (CeFi),Payments,Cryptocurrency,"Alchemy Pay is a payment solutions provider that connects crypto and fiat economies. It enables businesses to accept crypto payments in-store and online, bridging the gap between traditional and digital finance.",Alchemy Pay,0.022996 -0.000003 (-0.01%),-3e-06,-0.01%,214021000.0,19005000.0,Cryptocurrencies,Centralized Finance (CeFi),Payments,ACH,,,Unknown,True
50,ACOIN-USD,Acoin USD,1410566400.0,"Acoin (ACOIN) is a cryptocurrency . Users are able to generate ACOIN through the process of mining. Acoin has a current supply of 1,220,084.956657. The last known price of Acoin is 0.00445286 USD and is up 0.00 over the last 24 hours. It is currently trading on 1 active market(s) with $0.00 traded over the last 24 hours. More information can be found at https://acoin.info/.",0.0,0.0,0.0,0.0,,USD,CoinMarketCap,CoinMarketCap,False,en-US,US,Cryptocurrency,True,HIGH,False,,Cryptocurrencies,Infrastructure,Payments,Acoin,Cryptocurrencies,Infrastructure,Payments,Cryptocurrency,Assuming Acoin is a standard cryptocurrency intended for use as a digital currency. It facilitates peer-to-peer transactions and potentially acts as a store of value.,Acoin,0.005121 0.000000 (0.00%),0.0,0.00%,6247.0,4.0,Cryptocurrencies,Infrastructure,Payments,ACOIN,,,Unknown,True
59,ADA-USD,Cardano USD,1506816000.0,"Cardano (ADA) is a cryptocurrency launched in 2017. Cardano has a current supply of 44,994,911,756.125233 with 35,224,212,741.266934 in circulation. The last known price of Cardano is 0.81156229 USD and is down -7.99 over the last 24 hours. It is currently trading on 1476 active market(s) with $2,571,010,174.33 traded over the last 24 hours. More information can be found at https://www.cardano.org.",1277239808.0,1586018350.0,1277239808.0,1277239808.0,,USD,CoinMarketCap,CoinMarketCap,False,en-US,US,Cryptocurrency,True,HIGH,False,,Smart Contract Platform,Infrastructure,Infrastructure,Cardano,Smart Contract Platform,Infrastructure,Infrastructure,Native Currency,Cardano is a proof-of-stake blockchain platform that aims to provide a more secure and scalable infrastructure for decentralized applications and finance. It uses the Ouroboros consensus protocol and supports smart contracts through its Plutus language.,Cardano,0.823524 -0.003802 (-0.46%),-0.003802,-0.46%,29160000000.0,946052000.0,Smart Contract Platform,Infrastructure,Infrastructure,ADA,ADA,"['US Strategic Crypto Reserve', 'Made in America', 'Cardano Ecosystem', 'Binance Ecosystem', 'Alleged SEC Securities', 'Research', 'Layer 1', 'Smart Contracts']",US Strategic Crypto Reserve; Made in America; Cardano Ecosystem; Binance Ecosystem; Alleged SEC Securities; Research; Layer 1; Smart Contracts,True
60,ADC-USD,AudioCoin USD,1433462400.0,"AudioCoin (ADC) is a cryptocurrency . Users are able to generate ADC through the process of mining. AudioCoin has a current supply of 980,733,270.76465 with 0 in circulation. The last known price of AudioCoin is 0.00098272 USD and is up 0.00 over the last 24 hours. It is currently trading on 2 active market(s) with $0.00 traded over the last 24 hours. More information can be found at http://www.audiocoin.eu/.",3.0,0.0,3.0,3.0,,USD,CoinMarketCap,CoinMarketCap,False,en-US,US,Cryptocurrency,True,HIGH,False,,Cryptocurrencies,Entertainment/Leisure,Music,AudioCoin,Cryptocurrencies,Entertainment/Leisure,Music,Cryptocurrency,Audiocoin (ADC) is a cryptocurrency designed to support musicians and the music industry. It aims to provide a decentralized way for artists to be compensated for their work and connect with fans.,AudioCoin,0.000983 0.000000 (0.00%),0.0,0.00%,0.0,3.0,Cryptocurrencies,Entertainment/Leisure,Music,ADC,,,Unknown,True
64,ADK-USD,Aidos Kuneen USD,1496707200.0,"Aidos Kuneen (ADK) is a cryptocurrency . Aidos Kuneen has a current supply of 25,000,000 with 0 in circulation. The last known price of Aidos Kuneen is 0.01893097 USD and is up 0.00 over the last 24 hours. It is currently trading on 11 active market(s) with $0.00 traded over the last 24 hours. More information can be found at http://aidoskuneen.com/.",0.0,0.0,0.0,0.0,,USD,CoinMarketCap,CoinMarketCap,False,en-US,US,Cryptocurrency,True,HIGH,False,,Cryptocurrencies,Infrastructure,Payments,ADK,Cryptocurrencies,Infrastructure,Payments,Cryptocurrency,Aidos Kuneen (ADK) aimed to be a privacy-focused cryptocurrency with a focus on security and anonymity. It proposed a decentralized autonomous system (DAS) but its development and adoption faltered.,Aidos Kuneen,0.018931 0.000000 (0.00%),0.0,0.00%,0.0,0.0,Cryptocurrencies,Infrastructure,Payments,ADK,,,Unknown,True
65,ADM-USD,ADAMANT Messenger USD,1547683200.0,"ADAMANT Messenger (ADM) is a cryptocurrency launched in 2017. Users are able to generate ADM through the process of mining. ADAMANT Messenger has a current supply of 111,837,463 with 110,370,831 in circulation. The last known price of ADAMANT Messenger is 0.02520503 USD and is down -7.72 over the last 24 hours. It is currently trading on 15 active market(s) with $449,534.93 traded over the last 24 hours. More information can be found at https://adamant.im.",334090.0,414627.0,334090.0,334090.0,,USD,CoinMarketCap,CoinMarketCap,False,en-US,US,Cryptocurrency,True,HIGH,False,,dApps,Infrastructure,Messaging,ADM,dApps,Infrastructure,Messaging,Cryptocurrency,"ADAMANT Messenger is a decentralized messaging application that leverages blockchain technology for secure and anonymous communication. It utilizes its native cryptocurrency, ADM, for various functions within the ecosystem, including transaction fees and rewarding validators.",ADAMANT Messenger,0.017508 -0.000019 (-0.11%),-1.9e-05,-0.11%,1932000.0,151559.0,dApps,Infrastructure,Messaging,ADM,,,Unknown,True
68,ADP-USD,Adappter Token USD,1608163200.0,"Adappter Token (ADP) is a cryptocurrency launched in 2019and operates on the Ethereum platform. Adappter Token has a current supply of 10,000,000,000 with 4,534,832,902 in circulation. The last known price of Adappter Token is 0.00176476 USD and is down -7.05 over the last 24 hours. It is currently trading on 14 active market(s) with $1,119,257.90 traded over the last 24 hours. More information can be found at https://adappter.io/eng.html.",418666.0,4928563.0,418666.0,418666.0,,USD,CoinMarketCap,CoinMarketCap,False,en-US,US,Cryptocurrency,True,HIGH,False,,dApps,Marketing & Advertising,Ad Tech,ADP,dApps,Marketing & Advertising,Ad Tech,Utility Token,"Adappter Token is a utility token designed to facilitate transactions and incentivize participation within the Adappter ecosystem, a platform focused on connecting advertisers and publishers while prioritizing privacy. It aims to disrupt traditional advertising models with a decentralized, transparent, and user-centric approach.",Adappter Token,0.001906 -0.000047 (-2.38%),-4.7e-05,-2.38%,8832000.0,765530.0,dApps,Marketing & Advertising,Ad Tech,ADP,,,Unknown,True
70,ADS-USD,Adshares USD,1502496000.0,"Adshares (ADS) is a cryptocurrency . Adshares has a current supply of 38,758,206 with 38,744,454.897763 in circulation. The last known price of Adshares is 0.54537331 USD and is down -1.13 over the last 24 hours. It is currently trading on 37 active market(s) with $24,681.73 traded over the last 24 hours. More information can be found at https://adshares.net/.",31799.0,43918.0,31799.0,31799.0,,USD,CoinMarketCap,CoinMarketCap,False,en-US,US,Cryptocurrency,True,HIGH,False,,dApps,Advertising,Decentralized Advertising,ADS,dApps,Advertising,Decentralized Advertising,Cryptocurrency,"Adshares is a decentralized advertising marketplace connecting publishers and advertisers directly, eliminating intermediaries. It uses blockchain technology for transparent and efficient ad transactions and payments.",Adshares,0.425132 +0.000941 (+0.22%),0.000941,+0.22%,16471000.0,13570.0,dApps,Advertising,Decentralized Advertising,ADS,ADS,['Marketing'],Marketing,True
71,ADX-USD,AdEx USD,1498867200.0,"AdEx (ADX) is a cryptocurrency and operates on the Ethereum platform. AdEx has a current supply of 150,000,000 with 144,046,026.928 in circulation. The last known price of AdEx is 0.11729636 USD and is down -1.30 over the last 24 hours. It is currently trading on 78 active market(s) with $4,868,445.17 traded over the last 24 hours. More information can be found at https://www.adex.network/.",4259272.0,11662188.0,4259272.0,4259272.0,,USD,CoinMarketCap,CoinMarketCap,False,en-US,US,Cryptocurrency,True,HIGH,False,,dApps,Marketing & Advertising,Advertising Platforms,ADX,dApps,Marketing & Advertising,Advertising Platforms,Cryptocurrency,"AdEx Network is a decentralized ad network aiming to connect advertisers and publishers directly, eliminating intermediaries. It focuses on transparency and efficiency in digital advertising.",AdEx,0.124964 +0.007938 (+6.78%),0.007938,+6.78%,18482000.0,10677000.0,dApps,Marketing & Advertising,Advertising Platforms,ADX,ADX,"['Marketing', 'x402 Ecosystem', 'Account Abstraction']",Marketing; x402 Ecosystem; Account Abstraction,True
72,ADZ-USD,Adzcoin USD,1451088000.0,"Adzcoin (ADZ) is a cryptocurrency . Users are able to generate ADZ through the process of mining. Adzcoin has a current supply of 49,827,042.760948 with 0 in circulation. The last known price of Adzcoin is 0.00085819 USD and is up 0.00 over the last 24 hours. It is currently trading on 1 active market(s) with $0.00 traded over the last 24 hours. More information can be found at https://adzcoin.org/.",225.0,2.0,225.0,225.0,,USD,CoinMarketCap,CoinMarketCap,False,en-US,US,Cryptocurrency,True,HIGH,False,,Cryptocurrencies,Advertising,Advertising Payments,ADZ,Cryptocurrencies,Advertising,Advertising Payments,Cryptocurrency,"Adzcoin (ADZ) was a cryptocurrency designed to reward users for viewing advertisements and provide advertisers with a more efficient way to reach their target audience. The project is now defunct, rendering the token functionally obsolete.",Adzcoin,0.001175 0.000000 (0.00%),0.0,0.00%,0.0,43.0,Cryptocurrencies,Advertising,Advertising Payments,ADZ,,,Unknown,True
75,AERGO-USD,Aergo USD,1545004800.0,"Aergo (AERGO) is a cryptocurrency . Aergo has a current supply of 500,000,000 with 472,499,995.7689212 in circulation. The last known price of Aergo is 0.0704086 USD and is down -1.50 over the last 24 hours. It is currently trading on 102 active market(s) with $4,558,708.54 traded over the last 24 hours. More information can be found at https://www.aergo.io/.",4634599.0,20603683.0,4634599.0,4634599.0,,USD,CoinMarketCap,CoinMarketCap,False,en-US,US,Cryptocurrency,True,HIGH,False,,Smart Contract Platform,Infrastructure,Infrastructure,Aergo,Smart Contract Platform,Infrastructure,Infrastructure,Native Currency,Aergo is an open-source hybrid blockchain platform that combines a public blockchain with private blockchain capabilities. It aims to provide businesses with a secure and customizable platform for building and deploying decentralized applications.,Aergo,0.133992 +0.000591 (+0.44%),0.000591,+0.44%,64986000.00000001,8836000.0,Smart Contract Platform,Infrastructure,Infrastructure,AERGO,,,Unknown,True
78,AE-USD,Æternity USD,1496275200.0,"Æternity (AE) is a cryptocurrency . Users are able to generate AE through the process of mining. Æternity has a current supply of 396,262,883.69932 with 385,106,897.5 in circulation. The last known price of Æternity is 0.02098464 USD and is up 1.22 over the last 24 hours. It is currently trading on 33 active market(s) with $916,836.41 traded over the last 24 hours. More information can be found at https://www.aeternity.com/.",530864.0,609278.0,530864.0,530864.0,,USD,CoinMarketCap,CoinMarketCap,False,en-US,US,Cryptocurrency,True,HIGH,False,,Smart Contract Platform,Infrastructure,Infrastructure,AE,Smart Contract Platform,Infrastructure,Infrastructure,Native Currency,Æternity is a blockchain platform designed for scalable smart contracts. It features state channels for off-chain scaling and decentralized oracles for real-world data integration.,Æternity,0.006821 +0.000154 (+2.31%),0.000154,+2.31%,2627000.0,274472.0,Smart Contract Platform,Infrastructure,Infrastructure,AE,,,Unknown,True
83,AG8-USD,AtromG8 USD,1588550400.0,"AtromG8 (AG8) is a cryptocurrency launched in 2018. AtromG8 has a current supply of 84,000,000 with 42,000,000 in circulation. The last known price of AtromG8 is 0.00775939 USD and is up 0.02 over the last 24 hours. It is currently trading on 5 active market(s) with $3,428.51 traded over the last 24 hours. More information can be found at https://atromg8.com/.",3428.0,3428.0,3428.0,3428.0,,USD,CoinMarketCap,CoinMarketCap,False,en-US,US,Cryptocurrency,True,HIGH,False,,Cryptocurrencies,Infrastructure,Payments,AtromG8,Cryptocurrencies,Infrastructure,Payments,Cryptocurrency,AtromG8 is a cryptocurrency designed for fast and secure transactions. It aims to provide a decentralized and efficient payment system with a focus on scalability.,AtromG8,0.007762 0.000000 (0.00%),0.0,0.00%,325997.0,3427.0,Cryptocurrencies,Infrastructure,Payments,AG8,,,Unknown,True
92,AGRS-USD,Agoras: Tau Net USD,1440374400.0,"Agoras: Tau Net (AGRS) is a cryptocurrency launched in 2015and operates on the Ethereum platform. Agoras: Tau Net has a current supply of 42,000,000 with 29,861,810.83728983 in circulation. The last known price of Agoras: Tau Net is 0.66757551 USD and is down -3.25 over the last 24 hours. It is currently trading on 25 active market(s) with $32,895.96 traded over the last 24 hours. More information can be found at https://tau.net/.",39349.0,120724.0,39349.0,39349.0,,USD,CoinMarketCap,CoinMarketCap,False,en-US,US,Cryptocurrency,True,HIGH,False,,Smart Contract Platform,Infrastructure,Infrastructure,AGRS,Smart Contract Platform,Infrastructure,Infrastructure,Native Currency,"Agoras: Tau Net is a smart contract platform focused on AI and decentralized computation. Its native token, AGRS, is used for transaction fees and governance within the Tau Net ecosystem.",Agoras: Tau Net,1.0289 +0.0024 (+0.23%),0.0024,+0.23%,30726000.0,49096.0,Smart Contract Platform,Infrastructure,Infrastructure,AGRS,,,Unknown,True
134,AKT-USD,Akash Network USD,1602806400.0,"Akash Network (AKT) is a cryptocurrency . Akash Network has a current supply of 248,285,800.802151 with 248,285,794.661141 in circulation. The last known price of Akash Network is 1.32633124 USD and is down -5.03 over the last 24 hours. It is currently trading on 116 active market(s) with $8,462,878.34 traded over the last 24 hours. More information can be found at https://akash.network.",4918974.0,14783551.0,4918974.0,4918974.0,,USD,CoinMarketCap,CoinMarketCap,False,en-US,US,Cryptocurrency,True,HIGH,False,,Cryptocurrencies,Infrastructure,Cloud Computing,AKT,Cryptocurrencies,Infrastructure,Cloud Computing,Native Currency,Akash Network is a decentralized cloud computing marketplace that allows users to buy and sell computing resources. It aims to provide a more efficient and cost-effective alternative to traditional cloud providers.,Akash Network,1.4014 +0.0298 (+2.17%),0.0298,+2.17%,347949000.0,8855000.0,Cryptocurrencies,Infrastructure,Cloud Computing,AKT,AKT,"['Osmosis Ecosystem', 'Generative AI', 'Cosmos Ecosystem']",Osmosis Ecosystem; Generative AI; Cosmos Ecosystem,True
